Role,Content
user,"Lets discuss Evolution of the diving mask and snorkel
. What are your thoughts?"
model,"The evolution of the diving mask and snorkel is a fascinating transition from primitive survival tools to sophisticated precision equipment. Here is a breakdown of that progression:

### 1. The Snorkel: From Reed to Polymer
*   **Ancient Origins:** Early divers used hollow reeds or animal bladders to breathe at the surface, primarily for sponge diving in the Mediterranean.
*   **The ""J"" Tube:** By the mid-20th century, the simple J-shaped tube became the standard. 
*   **Modern Enhancements:** The design evolved to include purge valves (for clearing water), splash guards, and dry-tops (which use a float mechanism to seal the tube if submerged), making snorkeling accessible to casual swimmers.

### 2. The Diving Mask: From Vision to Seal
*   **Early Innovations:** Historically, divers used ""goggles"" (separate lenses), which caused massive pressure issues because the nose wasn't included—making equalization impossible.
*   **The Single Lens Breakthrough:** In the 1930s and 40s, Guy Gilpatric and others helped popularize the single-pane glass mask that covered the nose. This allowed divers to equalize pressure by exhaling through the nose into the mask, a fundamental leap for safety.
*   **Material Evolution:** We moved from heavy metal or wood frames with rubber gaskets to lightweight tempered glass and silicone. Modern silicone skirts are hypoallergenic and provide a much better seal against various facial structures.

### 3. Key Technological Leaps
*   **Equalization:** Covering the nose was the single most important development in the history of diving, allowing for depth rather than just surface swimming.
*   **Materials:** The shift from natural rubber (which degraded quickly and caused allergic reactions) to medical-grade silicone made masks more comfortable and durable.
*   **Optics:** Modern low-volume masks are designed to minimize the air space inside the mask, making them easier to clear and reducing the amount of mask squeeze at depth.
*   **Full-Face Masks:** Recent years have seen the rise of full-face snorkeling masks. While polarizing due to CO2 buildup risks in poorly designed models, they represent a desire to make the sport more ""natural"" by allowing nose-breathing.

### Thoughts on the Future
The gear has reached a plateau of high efficiency, but the next phase is likely **integration**. We are already seeing ""smart"" masks with integrated heads-up displays (HUDs) for scuba divers, showing depth, time, and air pressure directly on the lens. 

**Summary:** The evolution is defined by a shift from **necessity** (simply wanting to see underwater) to **comfort and safety** (managing pressure, improving visibility, and ergonomic fit). It turned diving from a dangerous occupation for specialized laborers into a global recreational pastime."
user,"This is a compelling historical arc. When you strip away the plastic and silicone, you’re really looking at a series of engineering solutions to the ""physics of the human body"" rather than just the physics of the water.

Your point about the **nose-enclosure breakthrough** really highlights the difference between *observing* the ocean and *occupying* it. It makes me wonder: if the mask and snorkel were the keys to unlocking the shallows, what do you think is the ""last frontier"" of personal underwater exploration?

Building on your thoughts, I have a few inquisitive follow-ups:

### 1. The Human Interface
You mentioned the ""natural"" feeling of full-face masks. It’s fascinating how we constantly strive to trick our brains into thinking we aren't underwater. Do you think we will eventually move away from masks entirely? Perhaps toward **""bionic"" contact lenses** or synthetic gill technology that allows us to bypass the air-space problem (and thus the squeeze and equalization issues) altogether?

### 2. The Cognitive Load of ""Smart"" Gear
With the HUDs you mentioned, we’re starting to see an influx of data into a space that was previously meditative and silent. Do you think this integration will enhance the experience, or will it detract from the ""zen"" of diving? Are we risking ""screen fatigue"" underwater?

### 3. The Psychology of ""The Seal""
The most primitive part of any mask is the silicone skirt—the point where the human body meets the machine. Even with perfect engineering, it remains the most common point of failure (a stray hair, a smile, a slight facial shift). Why do you think, after all these centuries, we still haven't moved to a ""universal fit"" solution? Is the human face simply too diverse a landscape to be captured by a single design?

**I’m curious:** When you look at the progression from reeds to HUDs, do you see this as the final stage of evolution, or are we just waiting for a new material science breakthrough—like a ""smart skin""—to replace the mask entirely?"
model,"These are profound questions. You’ve touched on the tension between **human biology** (which is fundamentally terrestrial) and the **oceanic environment** (which is fundamentally indifferent to us).

Here are my thoughts on your inquiries:

### 1. The Human Interface: Bionics vs. Mechanics
We are currently at the limit of what *passive* gear can do. Bypassing the air-space problem is the ""Holy Grail."" 
*   **The Contact Lens Solution:** If we could develop contact lenses with optical correction for underwater refraction (which makes objects appear ~33% larger and closer), we would solve the vision aspect. However, the **cornea is not designed for direct water contact**—not just for irritation, but for the osmotic exchange of fluid. We’d likely need a ""smart film"" coating for the eye that acts as an artificial tear layer.
*   **Synthetic Gills:** This is the ultimate ""last frontier."" Bypassing the lung-breath cycle would eliminate buoyancy shifts caused by breathing, removing a massive source of anxiety and physical fatigue. We are currently limited by the sheer volume of water one must process to extract oxygen; until we have a bio-synthetic surface area that can process liters of water per second without mechanical pumps, we remain tied to the tank.

### 2. The Cognitive Load: HUDs and the Death of ""Zen""
This is the ""Google Glass"" dilemma of the deep. 
*   **The Risk:** Diving is one of the few places left where humans are forced to be ""analog."" If we overlay a data-stream—heart rate, depth, time, nitrogen loading—we risk converting a sensory experience into a data-management task. 
*   **The Counter-Argument:** For technical diving or high-risk exploration, data *is* safety. If the HUD is ambient—meaning it only alerts when a boundary is crossed or a limit is approaching—it could actually *increase* the Zen by removing the need to constantly check a wrist computer. It becomes an extension of the peripheral nervous system rather than a screen to read.

### 3. The Psychology of ""The Seal"": The Failure of Uniformity
Why, after all this time, is the skirt still so temperamental?
*   **Biological Uniqueness:** The human face is a complex landscape of cartilage, fat pads, and varying bone structure. Every time you speak, swallow, or change your expression, your face physically changes shape. A rigid mask can never be a ""universal fit"" because the face itself is never static. 
*   **The Next Frontier:** We are likely moving toward **3D-scanned, custom-molded masks.** Rather than trying to design a mask for all faces, we will use smartphone-based photogrammetry to scan a diver's face and 3D-print a custom silicone skirt that fits like a second skin. It isn't a new material—it’s a move from ""mass manufacturing"" to ""precision customization.""

### Are we at the final stage?
I don't think we are at the end; I think we are at the **transition from ""tool-user"" to ""integrated-organism.""** 

The mask and snorkel were tools we *held* or *wore*. The future is **wearable technology that mimics biological function.** We are currently trying to ""bridge"" the gap between land and water. The final stage won't be a better mask; it will be a way to negate the need for the mask entirely—perhaps through ocular modifications or respiratory implants that turn the human body into a vessel that is at home in both mediums.

We are currently the ""cyborg"" generation of diving, using digital and mechanical bridges to cheat the limitations of our evolution. The question is: **Do we want to lose the struggle?** There is something about the ""leaky mask"" that keeps us humble—it reminds us that we are guests in a world we were not built for. If we make it too easy, we might lose the reverence for the environment itself."
