Role,Content
user,"Lets discuss Extremweather phenomena
. What are your thoughts?"
model,"Extreme weather phenomena—such as heatwaves, intensified hurricanes, and prolonged droughts—are becoming more frequent and severe, largely driven by climate change. 

My ""thoughts"" are based on consensus data:

*   **Atmospheric Physics:** A warmer atmosphere holds more water vapor (roughly 7% more per 1°C of warming), which fuels heavier rainfall and more intense storm systems.
*   **Systemic Shifts:** We are moving away from historical climate norms, making infrastructure, agriculture, and urban planning designed for the 20th century increasingly inadequate.
*   **Economic Impact:** The cost of disaster recovery is rising exponentially, creating significant fiscal strain on both governments and insurance markets.
*   **Adaptation vs. Mitigation:** The challenge is dual-pronged: we must aggressively reduce emissions (mitigation) while simultaneously hardening our infrastructure to withstand the inevitable changes already ""baked into"" the system (adaptation).

Which specific aspect of extreme weather would you like to explore—the science behind it, the economic fallout, or perhaps mitigation strategies?"
user,"This is a fascinating framework you’ve laid out. As an inquisitive mind, I find myself drawn to the friction point between your **systemic shifts** and **adaptation**. 

Specifically, I am curious about the **""adaptation trap.""** 

If we design infrastructure—seawalls, grid hardening, urban heat-mitigation—based on the climate models of today, are we inadvertently building a ""sunk cost"" fallacy? By ""hardening"" systems to current projections, do we risk creating assets that become obsolete or even maladaptive if the climate trajectories tip into higher-end warming scenarios?

To unpack this, I’d like to explore the **engineering and ethical philosophy of adaptation:**

1.  **The ""Moving Target"" Problem:** How do engineers and urban planners build for a climate that is non-stationary? Is there a shift toward ""flexible"" or ""modular"" infrastructure that can evolve, rather than the static, concrete-heavy solutions of the 20th century?
2.  **The Ethics of Managed Retreat:** In the face of intensifying hurricanes and sea-level rise, at what point does ""hardening"" transition from a necessary adaptation into an unsustainable economic burden? Who gets to decide which communities are fortified and which are moved?
3.  **The Cascading Failure Risk:** In complex, hyper-connected urban environments, how do we account for the ""interdependency risk""? (e.g., a heatwave causes a power outage, which shuts down water pumps, which prevents fire suppression during a wind-driven wildfire).

Which of these facets feels most pressing to you? Are we over-relying on the idea that we can ""engineer"" our way out of this, or is a fundamental redesign of how we inhabit the planet the only viable path forward?"
model,"These are profound questions that cut to the core of the 21st-century survival strategy. You’ve identified the exact tension between ""resilience"" (bouncing back to a previous state) and ""transformation"" (changing to survive a new one).

Here is a brief analysis of those three facets:

### 1. The ""Moving Target"" and Modular Engineering
We are witnessing a slow pivot from **static engineering** (concrete walls) to **adaptive pathways**. Engineers are increasingly moving away from ""safety factors"" (building for the 100-year flood) and toward **Robust Decision Making (RDM)**. This involves designing infrastructure that is:
*   **Modular/Scalable:** Building foundations that can support a seawall 5 feet higher in 30 years if sea-level rise accelerates beyond current models.
*   **Nature-Based:** Using mangroves or ""living shorelines"" that grow and replenish themselves, unlike static concrete which only degrades.
*   **Dynamic:** Designing grids that prioritize ""island-ability,"" where localized microgrids can detach from the main system during failure, preventing the domino effect.

### 2. The Ethics of Managed Retreat
This is arguably the most difficult political challenge. Hardening is often an **""adaptation paradox""**: by shielding high-value real estate (seawalls in Miami, for example), we often provide a false sense of security that encourages *more* development in high-risk zones, effectively trapping more wealth in the path of destruction.
*   **The Decision-Maker:** Currently, this is determined by market value and political capital—which inevitably favors the wealthy. 
*   **The Ethical Shift:** We need a framework for **Managed Retreat** that isn't punitive. It requires a shift from ""protecting assets"" to ""protecting livelihoods,"" which may involve buy-out programs that allow communities to move inland as a unified social unit, preserving their cultural identity rather than forcing atomized displacement.

### 3. Cascading Failure and Interdependency
Our reliance on ""Just-in-Time"" efficiency has created fragile systems. In climate science, we now focus on **""Systemic Risk""** rather than individual failure points. 
*   **The Solution:** Resilience engineering now focuses on **Redundancy and Decoupling.** If a city is hyper-connected, a single failure acts as a virus. By building ""functional silos""—where decentralized water, power, and food systems can operate independently of the national grid—we mitigate the risk of a total urban collapse.

### My Perspective: Are we over-relying on engineering?
I believe we are currently in a period of **technological hubris**. We are attempting to use 20th-century ""Command and Control"" engineering to manage a chaotic, non-linear climate system. 

The only viable path forward is to stop treating the environment as an external enemy to be ""defended"" against and start treating it as a system we must inhabit with **""architectural humility.""** This means recognizing that some geographies—coastal zones, fire-prone wildlands—are becoming *functionally incompatible* with static human habitation. 

If we don't start shifting from ""hardened defense"" to ""strategic relocation,"" we aren't engineering a future; we are just building a more expensive trap.

**Which of these strikes you as the biggest hurdle? Is it the technical difficulty of the engineering, or the political impossibility of deciding who retreats?**"
