Role,Content
user,"Lets discuss History of the world's deepest mines
. What are your thoughts?"
model,"The history of the world's deepest mines is a fascinating intersection of human ambition, engineering ingenuity, and the physical limits of the Earth.

Here is a summary of the key themes:

### 1. The Geothermal Barrier
The primary challenge in deep mining is not structural engineering—it is **heat**. As you descend, the rock temperature increases (the geothermal gradient). At depths like 3–4 kilometers, the virgin rock temperature can exceed 60°C (140°F), requiring massive refrigeration plants to keep air temperatures survivable for miners.

### 2. The South African Gold Rush
South Africa has long dominated the list of the world's deepest mines, specifically in the Witwatersrand Basin.
*   **Mponeng Gold Mine:** Currently the deepest mine in the world, reaching nearly **4 kilometers (2.5 miles)** below the surface.
*   **The ""Deep-Level"" Evolution:** These mines evolved from shallow pits in the late 19th century to massive, vertical industrial complexes. They represent the apex of mining technology, utilizing complex ventilation, cooling, and seismic monitoring systems to manage the intense rock pressure.

### 3. Safety and Seismic Risk
As mines go deeper, the **in-situ stress** of the rock increases exponentially. This leads to ""rockbursts""—sudden, violent releases of energy caused by the Earth’s crushing pressure. Modern deep-level mining history is defined by the constant evolution of seismic support systems (dynamic rock bolts, mesh, and rigid arches) to protect miners from these events.

### 4. Why go so deep?
Deep mining is driven entirely by **ore grades**. Near-surface deposits are often exhausted, forcing companies to chase veins of gold, copper, or platinum deeper into the crust. Economically, it is a race between the rising price of commodities and the astronomical cost of cooling and hoisting ore from extreme depths.

### 5. The Future: The Limit of Extraction
We are likely approaching the physical limit for deep mining. Beyond 4,000–5,000 meters, the cost of cooling and the risk of catastrophic seismic failure become prohibitively high. The industry is currently shifting toward:
*   **Automation:** Using robotic equipment to operate in areas too hot or unstable for humans.
*   **Vertical Shaft Sinking Technology:** Improving the speed and cost of reaching deep deposits.

**My take:** The history of these mines is a testament to how far we will go to extract raw materials. They are essentially ""inverted skyscrapers,"" and the engineering required to sustain life 4km underground is arguably as complex as that required for space travel.

Do you have a specific mine or era you are interested in exploring further?"
user,"Your description of these mines as ""inverted skyscrapers"" is a profound metaphor—it perfectly captures the spatial inversion of human progress. While we traditionally look toward the stars to challenge our technological limits, these mines represent an equally daunting frontier, digging into the ""inner space"" of our own planet.

I find myself lingering on the **""Geothermal Barrier.""** It strikes me as a fascinating irony: we are mining to fuel our modern, electrified, heat-generating world, yet the planet itself essentially pushes back with a fever, trying to melt the very tools we use to extract its wealth.

Since you opened the door to exploring specific eras or facets, I am curious about your thoughts on two specific angles:

**1. The Psychological Frontier:**
We have extensive literature on the psychology of astronauts—people isolated in a hostile, high-pressure environment far from the surface. Have you encountered any accounts of the ""culture"" or psychological toll of the miners who spend their days 4 kilometers down? When you are that deep, the surface world must feel like a theoretical concept. Does the nature of the work change the way these communities perceive time or the ""surface"" world?

**2. The Inevitable Pivot to Robotics:**
You mentioned that we are nearing the physical limit for humans. If we fully automate these mines, we are essentially creating ""robotic ecosystems"" where temperature and seismic risk no longer matter—only mechanical durability does. If we remove the human element, do you think we will suddenly unlock a ""second wave"" of deep mining that goes far deeper than 5km? Or does the physical pressure eventually crush the machinery just as easily as it would a human?

I’m also curious—if you could design a theoretical ""deep-tech"" mining solution that bypassed the cooling requirement entirely, what would that look like to you? Are we talking about exotic materials for drill bits, or something entirely different, like plasma-drilling?"
model,"These are profound inquiries that move beyond simple engineering into the philosophy of industry. Here are my thoughts on your two points and your ""deep-tech"" challenge:

### 1. The Psychological Frontier: The ""Inverted Astronaut""
You hit on something crucial. While astronauts have the psychological ""anchor"" of seeing Earth through a window, deep-level miners work in a sensory deprivation chamber.

*   **The ""Deep-Level"" Mindset:** Miners in places like the Witwatersrand often speak of ""The Shift"" as a different reality. The extreme humidity and heat (often 95%+) create a physiological stress that necessitates a distinct, stoic culture. Communication is often non-verbal due to the deafening roar of industrial machinery, fostering a hyper-awareness of one's surroundings—you learn to ""listen"" to the rock.
*   **Time Distortion:** Without natural light, time is measured in ""cycles"" (blasting cycles, ventilation shifts) rather than the solar clock. There is a documented phenomenon among deep-miners where they experience a ""re-entry shock"" when returning to the surface; the vastness of the sky and the absence of constant mechanical noise can feel disorienting, even agoraphobic.
*   **Camaraderie as Survival:** In these high-pressure, high-heat environments, the psychological bond is forged in a ""brotherhood of the abyss."" The trust required is absolute, as your life depends on the person monitoring the ventilation systems or the rock-bolting integrity.

### 2. The Robotic Pivot: Beyond the 5km Wall
Will robotics unlock a ""second wave""? **Yes, but with caveats.**

*   **The Depth Threshold:** If we remove the cooling requirement (which is for humans, not machines), the primary limit shifts to **Rock Mechanics**. At 6km+, the lithostatic pressure (the weight of the rock above) can exceed the compressive strength of the rock itself, causing the walls of the tunnels to ""spall"" or explode into the cavity.
*   **The Mechanical Limit:** Even robots need to move. If a machine is operating in a tunnel that is constantly ""squeezing"" inward due to high-pressure plastic deformation of the rock, the machine will eventually be crushed. We would have to move away from traditional tunnels toward **""Micro-Mining""**—where remote, swarm-based robots drill tiny, precise holes rather than open-space tunnels, leaving the earth largely intact.

### Designing the ""Deep-Tech"" Solution: Plasma-Drilling
If I were to bypass the geothermal and mechanical barriers, I would look toward **Thermal-Pulse/Plasma-Arc Excavation.**

*   **The Concept:** Instead of mechanical drill bits (which are consumable, prone to overheating, and rely on torque), we use a high-energy plasma torch to vitrify the rock.
*   **Why it works:** You aren't ""digging"" in the traditional sense; you are turning the rock face into glass. The laser/plasma beam passes through the rock, turning it into a molten slag that is then sucked away or allowed to cool into a hardened, reinforced tunnel liner. 
*   **The Benefit:** 
    1. **Zero Mechanical Wear:** No drill heads to replace at 4km depth. 
    2. **Structural Integrity:** By vitrifying the walls (turning them into obsidian-like glass), you create a natural, self-supporting reinforcement that prevents rockbursts.
    3. **Thermal Management:** You turn the Earth's ""fever"" against itself—using the existing heat to aid in the molten transition of the rock, potentially requiring less external energy to melt the material.

**My takeaway:** We are essentially transitioning from the era of ""Mechanical Extraction"" to ""Material Manipulation."" We stop fighting the rock and start treating the Earth’s crust as a medium to be sculpted, rather than a vault to be broken into. 

Do you think there is a point where we should stop? Or is the ""inner space"" just as much of a human destiny as the outer reaches of the solar system?"
