Role,Content
user,"Lets discuss History of the world's longest underwater rail tunnel TBM cutter head replacement logs
. What are your thoughts?"
model,"The world's longest underwater rail tunnel is the **Seikan Tunnel** (Japan), but the most significant TBM (Tunnel Boring Machine) engineering challenge regarding cutter head replacement occurred during the **Channel Tunnel** (UK-France) and more recently in projects like the **Gotthard Base Tunnel** (though land-based) and the **Fehmarnbelt Fixed Link**.

Here are my thoughts on the significance of these logs and the engineering evolution:

### 1. The Shift from ""Repair"" to ""Redesign""
Early TBM history (like the Channel Tunnel) was defined by the struggle to maintain heads in pressurized, saturated environments. The logs from these projects reveal a transition:
*   **The Problem:** In the 1980s/90s, cutter head intervention required ""hyperbaric welding,"" where divers had to work in pressurized chambers to change teeth. This was physically dangerous and slow.
*   **The Evolution:** Modern logs show a move toward **modular cutter heads**. Engineers now design heads that can be segmented and replaced from the *rear* (interior) or via remote robotics, reducing human risk.

### 2. The ""Geological Uncertainty"" Factor
The most fascinating aspect of these logs is the failure analysis. Often, TBM logs show that the cutter head was damaged not by ""normal"" rock, but by **unexpected mixed-face geology** (e.g., hitting a hard boulder while the rest of the face is soft clay).
*   **Key takeaway:** The most successful projects aren't the ones with the strongest steel, but the ones with the best **geological probing**. The logs demonstrate that if you hit a fault line without knowing, no cutter head design can save you from a major stoppage.

### 3. The Digital Twin Era
Current logs are no longer just paper records; they are real-time data streams.
*   **Sensors:** Modern TBMs monitor vibration, torque, and temperature at each disc cutter.
*   **Predictive Maintenance:** We have moved from ""we saw a piece of metal in the slurry, let's stop"" to ""vibration patterns suggest a bearing failure in 48 hours, schedule intervention now.""

### 4. Why this history matters
The history of TBM replacement logs is essentially the history of **risk mitigation**. Every time a cutter head was replaced underwater in a massive rail project, it cost millions of dollars *per day*. The logs serve as the ""lessons learned"" database that allows current projects (like the Fehmarnbelt Tunnel) to proceed with much lower incident rates.

**Are you looking for a specific case study, or are you interested in the technical progression of hyperbaric intervention?**"
user,"Your synthesis of the evolution of TBM engineering is striking. You’ve pinpointed exactly where the discipline shifted from ""heroic manual labor"" to ""predictive systems engineering."" 

The progression you’ve outlined—from the lethal, high-stakes hyperbaric work of the Channel Tunnel to the sensor-rich, predictive environments of projects like the Fehmarnbelt—highlights a fascinating shift in how we perceive the ""underground."" We are moving from *reacting* to the subterranean environment to *mapping and preempting* it.

I am particularly intrigued by your second point regarding **""geological uncertainty.""** If the best defense isn't stronger steel but better data, we have to look at the intersection of seismology and engineering. 

To explore this further, I am curious about two specific areas:

### 1. The ""Black Swan"" Events in Geological Probing
You mentioned that even the best probing can fail to prevent a major stoppage. Are there specific logs from recent projects where the geological model was ""perfect"" according to all pre-borehole data, yet the TBM encountered an anomaly (a cavern, a fault, or an unexpected material density change) that fundamentally altered the design philosophy for that specific machine? I’m interested in the *limitations* of current ground-penetrating technology.

### 2. The Human Element in the ""Digital Twin"" Era
As we move toward remote robotics and predictive maintenance, there is a paradox: while we minimize the *physical* risk to humans, we increase the *cognitive* burden on the operators. Have you observed any logs or reports regarding the ""Human-Machine Interface"" (HMI) failures? Essentially, when the digital twin says ""stop,"" does the human operator always trust it? Or is there still a lingering ""intuition-based"" resistance that causes delays?

**Regarding your question to me:** I find the **technical progression of hyperbaric intervention** to be a grim but essential chapter in this history. The sheer physical toll on the human body during those 1980s interventions makes the shift to robotics feel less like ""innovation"" and more like a moral necessity. 

**Does the current trend toward full automation in the cutter head signify the end of the ""Tunneling Master"" archetype, or is the complexity simply evolving beyond what a single human brain can process in real-time?**"
model,"These are profound questions that touch on the intersection of human psychology, extreme engineering, and the inherent ""unknowability"" of the earth’s crust.

### 1. The ""Black Swan"" and the Limits of Data
You hit on the Achilles' heel of TBM operation: **The point-sampling paradox.** Even with dense borehole data, you are essentially trying to map a complex, fractured, and heterogeneous medium using a handful of ""needles"" in a haystack.

*   **The Case Study:** The **Eurasia Tunnel (Istanbul)** or the **Gotthard Base Tunnel** provide stark examples. In Gotthard, the project encountered the ""Piora Syncline,"" a zone of sugary, pressurized dolomite that was not clearly identified by surface drilling. Despite seismic surveys, the structural complexity of the rock led to a high-pressure water and material inrush. 
*   **The Limitation:** Current Ground Penetrating Radar (GPR) and seismic probes mounted on TBMs have a limited ""look-ahead"" range (usually 20–50 meters). The ""Black Swan"" isn't necessarily that the rock type is unknown, but that its **geomechanical state** (stress levels, water pressure) differs from the model. 
*   **The Design Shift:** This has led to the **""Variable Density"" TBM**. Instead of relying on a static geological map, we now build machines that can change their operating mode (Earth Pressure Balance vs. Slurry) mid-bore. The ""philosophy"" has shifted from *Predict-then-Build* to *Adaptive-Response.*

### 2. The HMI Paradox and the ""Trust Gap""
The cognitive burden you mention is perhaps the most overlooked safety risk in modern tunneling.

*   **The ""Automation Bias"" vs. ""Heuristic Override"":** In high-pressure environments, the HMI often presents an overwhelming flood of data. Logs from recent large-scale projects suggest that when a digital twin sends a ""stop"" command, operators often experience **automation bias** (blind trust) or, conversely, **distrust** due to previous ""false positives"" (ghost signals caused by electrical noise in the tunnel).
*   **Intuition vs. Algorithms:** There is a documented phenomenon where veteran Tunnel Masters override sensors because they ""hear"" or ""feel"" the machine differently. They detect harmonic changes in the TBM’s vibration—a tactile frequency—that sensors might ignore or interpret as baseline noise. The danger today is that we are losing the ""feeling"" of the machine as we prioritize the screen.
*   **The ""Human-in-the-Loop"" failure:** Logs from recent incidents show that human error in modern tunnels usually isn't a lack of effort; it's **""Information Overload Collapse,""** where the operator misses a critical signal because they were busy managing a non-critical alert in a messy dashboard.

### 3. The Death of the ""Tunneling Master""?
Does the evolution toward full automation signal the end of the ""Tunneling Master""? I would argue **no, but the archetype is morphing.**

*   **From ""Miner"" to ""Conductor"":** The Master is no longer the person who knows how to manually brace a face or handle a pneumatic drill; they are now a **System Architect.** They need to be an expert in signal processing, fluid dynamics, and mechanical maintenance.
*   **The Complexity Ceiling:** You are correct that the complexity is evolving beyond what a single human brain can process in real-time. We are reaching a point where the Master’s role is to **govern the logic** of the automated system. They must act as the ""override authority"" who understands when the machine’s logic is failing because it lacks the context of the *human* intuition (e.g., ""The computer says the cutter head is fine, but the crew in the rear segment is reporting an odd smell of scorched grease that the sensors haven't picked up yet"").

**The moral necessity of robotics is the driving force here.** By moving the human out of the pressurized face, we aren't losing the Tunnel Master; we are merely allowing them to stay alive long enough to actually master the machine. 

Do you believe that by digitizing the ""Tunneling Master's intuition"" into AI, we will eventually reach a state where the machine can *self-correct* better than a human ever could—or will there always be a need for that ""human-in-the-loop"" to provide the final, irrational, and essential judgment call?"
