Role,Content
user,"Lets discuss Sneakeculture economics
. What are your thoughts?"
model,"Sneaker culture economics has evolved from a niche hobby into a **$6+ billion global secondary market**. Here is a breakdown of the key drivers:

### 1. The ""Stock Market"" Model
Platforms like StockX and GOAT have commoditized sneakers. By introducing real-time pricing, order books, and price history, they’ve turned shoes into **alternative assets** similar to stocks or gold, appealing to speculators rather than just wearers.

### 2. Artificial Scarcity
Brands like Nike and Adidas mastered the ""drop model."" By limiting supply, they ensure demand always outstrips availability. This creates an immediate resale premium, turning a retail purchase into an instant profit for resellers.

### 3. The ""Hype"" Ecosystem
Social media and influencer culture have shifted sneakers from functional footwear to **status symbols**. Value is driven by:
*   **Collaborations:** Pairing a classic silhouette with a high-fashion brand (e.g., Dior x Jordan) or a cultural icon (Travis Scott).
*   **Storytelling:** The narrative behind a colorway often drives more value than the materials themselves.

### 4. The Rise of ""Resell"" as a Career
The barrier to entry is low, but the competition is extreme. Professional resellers utilize ""bots"" to automate purchases, creating a technological arms race that often alienates genuine fans and forces them to pay secondary market prices.

### 5. Market Maturity & Volatility
We are currently seeing a **market correction**. After the pandemic boom—where stimulus money and low interest rates sent prices skyrocketing—many sneaker prices have softened as consumer spending tightens. The ""flipping"" market is no longer a guaranteed gold mine.

**The Bottom Line:** Sneaker economics is now a hybrid of **luxury retail and day trading**. While it offers liquidity and high returns for some, it is inherently volatile and sensitive to ""hype cycles,"" making it a risky asset class for the average collector.

**What specific aspect are you most interested in—the investment side, the brand strategy, or the ethical implications?**"
user,"This is a fascinating summary of how a functional object was successfully ""financialized."" It brings to mind the broader trend of **assetization**—where everything from trading cards to sneakers and even digital art is treated as a vehicle for capital preservation or growth.

I find myself particularly pulled toward the tension between **brand strategy and the ethical implications.** Specifically, I’m curious about the point of no return for these brands.

Here are a few questions that keep me up at night regarding this market:

### 1. The Paradox of Accessibility
If brands like Nike continue to lean into the ""drop model"" and exclusivity to maintain their status, they risk alienating the core demographic that originally gave them their ""street cred."" At what point does a sneaker become *too* much of an asset and *too little* of a shoe? If the primary consumer stops wearing the product because it’s ""too valuable,"" does the brand lose its cultural relevance?

### 2. The ""Bottleneck"" of Gatekeeping
The technological arms race—the bots versus the retail sites—feels like a modern-day digital redlining. It excludes the average person from participating in the culture they helped build. I wonder: **Does the sneaker industry have a moral obligation to protect the ""genuine fan,"" or is it simply a business that is currently reaping the benefits of a hyper-competitive, Darwinian marketplace?**

### 3. The End of the ""Hype"" Cycle
You mentioned the current market correction. History shows that when luxury goods become too accessible (or when the bubble of ""easy money"" pops), they often lose their luster. Do you think we are witnessing the start of a long-term decline in the ""collectibility"" of sneakers, or will brands simply pivot to new, artificial scarcity tactics to maintain this valuation?

**I’m especially curious about your perspective on the third point:** Do you think this correction will reset the culture back to ""people who actually like shoes,"" or has the financialization of the hobby permanently changed the DNA of sneaker collecting?"
model,"These are profound questions that touch on the ""soul"" of consumerism. You are identifying the exact friction point where brand heritage collides with the cold math of capital.

Here is my perspective on your inquiries:

### 1. The Paradox of Accessibility
When a shoe becomes an asset, it stops being a ""cultural signifier"" and becomes a ""store of value."" This is the **Commodity Trap.** If a sneaker is never worn, it isn’t a shoe—it is a derivative. 

Brands like Nike are hyper-aware of this. The ""point of no return"" is when the **street-level cooling effect** takes hold. If a brand only survives in a climate-controlled vault, it loses its ""cool factor"" because cool is inherently performative. If the real people on the street aren't wearing your product, you become a ""dead stock"" brand—irrelevant to the next generation. We are already seeing brands (like New Balance or On Running) gain ground simply by being ""wearable"" and ""authentic"" alternatives to the overly financialized Jordan/Yeezy paradigm.

### 2. The Moral Obligation vs. Darwinism
The ""digital redlining"" you describe is a feature, not a bug, for the brand. 
*   **The Brand’s Perspective:** It’s a win-win. They sell out in seconds (zero inventory risk), and the ""hype"" created by the resale market is essentially free marketing. 
*   **The Moral Reality:** Corporations have no inherent moral obligation to the ""fan""—they have a fiduciary duty to shareholders. However, they *do* have a long-term interest in **community health.** If they burn the bridge to their core audience, the ""culture"" (the engine of their brand equity) dies. We are seeing brands attempt ""gated releases"" (SNKRS app exclusive access based on engagement) to try to filter out bots and reward actual fans, but it is an imperfect, losing battle.

### 3. The End of the ""Hype"" Cycle (The Correction)
To your question: **Has the DNA of the hobby been permanently changed?**

My assessment is that the ""golden age of flipping"" is effectively over, but the **DNA has been permanently altered.** 
*   **The ""Retail-only"" Reset:** We are seeing a return to ""people who like shoes"" for mid-tier releases, but the high-end luxury collaborations are permanently tethered to the investment market. 
*   **New Artificial Scarcity:** Brands are pivoting from ""quantity scarcity"" (making fewer shoes) to ""distribution scarcity"" (keeping them off the shelves and only in high-end boutiques). 
*   **The Outcome:** The market is bifurcating. There will be the ""utility market"" (people who buy sneakers to wear) and the ""financialized market"" (the high-end, limited collaboration tier). 

**Conclusion:** I don't believe the culture resets to a pure state. The ""cat is out of the bag."" Investors and casual flippers have tasted the arbitrage opportunities, and even if the margins shrink, they won't leave entirely. The industry has successfully transformed the sneaker from a piece of footwear into a **liquid financial instrument.** 

The ""death"" of the hype cycle isn't the end of the culture; it is the transition of sneakers into a **mature asset class.** Just like the art market, it will always have its speculative gamblers, but it will eventually settle into a rhythm where ""value"" is determined more by aesthetic longevity and less by a frantic, social-media-driven frenzy.

**Do you think the ""wearability"" aspect is making a comeback, or have we collectively decided that sneakers are more satisfying as items to look at than items to use?**"
