Role,Content
user,"Lets discuss Solarpunfuture
. What are your thoughts?"
model,"Solarpunk is a compelling aesthetic and philosophical movement that imagines a sustainable future where technology, nature, and community are harmoniously integrated.

Here are the core pillars as I see them:

*   **Optimistic Pragmatism:** Unlike the dystopian or ""tech-bro"" utopian tropes, Solarpunk is grounded in realism. It focuses on feasible solutions like renewable energy, circular economies, and regenerative agriculture.
*   **The ""High-Tech, Low-Tech"" Balance:** It champions sophisticated green technology (solar panels, wind turbines, bio-architecture) alongside traditional craftsmanship, community gardening, and repair culture.
*   **Decentralization:** It envisions power—both electrical and political—moving away from massive, top-down monopolies toward localized, community-owned grids and governance.
*   **Aesthetic Continuity:** It rejects the sterile, cold futurism of the mid-20th century in favor of vibrant, organic, and art-nouveau-inspired landscapes where cities look more like forests than concrete jungles.

**My takeaway:** Solarpunk is an ""activist"" genre. It serves as a blueprint for hope, moving the conversation from ""how will we survive the collapse?"" to ""what are we going to build together?"" 

What aspect of the movement resonates most with you? The architecture, the political philosophy, or the environmental focus?"
user,"It is fascinating to analyze Solarpunk not just as an aesthetic trend, but as a deliberate pivot in human imagination. If we are to treat it as an ""activist genre,"" I find myself most drawn to the **""High-Tech, Low-Tech"" Balance.**

To me, this is the most radical pillar because it addresses the modern ""tech-dilemma."" We currently live in an era of *black-box technology*—devices we are discouraged from opening, software we don’t own, and infrastructures so complex that the average person is alienated from the very tools that sustain them. 

The Solarpunk insistence on marrying advanced green tech with traditional craftsmanship suggests a profound shift in the human relationship with *agency*. It asks: **How can we have the benefits of modern science without losing the tactile intelligence of our hands?**

I am endlessly curious about the *pedagogical* implications of this:

*   **The Re-skilling of Society:** If a community runs on a local micro-grid, the people living there must understand how that grid functions. Does this imply a future where ""literacy"" isn't just reading and writing, but an elementary understanding of thermodynamics, botany, and mechanical repair? 
*   **The Death of Planned Obsolescence:** If we value ""repair culture"" as a core pillar, we are essentially declaring war on the modern economic model of constant consumption. That isn’t just an aesthetic choice; it’s an economic revolution. How do we transition a global economy away from ""growth at all costs"" toward ""maintenance as a virtue"" without triggering a systemic collapse?
*   **Technology as a Tool, Not a Master:** Most sci-fi presents technology as something that happens *to* us (either to save us or destroy us). The Solarpunk vision turns technology into a craft—something that feels more like an heirloom or a garden than a sterile black mirror.

If we look at your pillars, I think the **political philosophy** is the necessary engine, but the **High-Tech/Low-Tech balance** is the *manifestation*. It creates a world where a person can be a master of their own surroundings.

I find myself wondering: **Do you think this movement is more likely to grow out of the ""bottom-up"" efforts of small, localized communes, or does it require a ""top-down"" shift in how we regulate manufacturing and waste to make this lifestyle even possible for the average person?** Can you really have a Solarpunk world while still living within a globalized, neoliberal framework?"
model,"Your analysis highlights the core friction point of Solarpunk: **it is inherently incompatible with the current neoliberal framework.**

To answer your question: It likely requires a ""pincer movement"" rather than one or the other. Here is why:

### 1. The Necessity of the ""Bottom-Up"" (The Sandbox)
Localized communes are the R&D labs for this future. When a neighborhood develops a community-owned solar micro-grid or a tool-lending library, they are proving that **autonomy is possible.** These projects act as ""proof of concept"" that dismantle the psychological reliance on corporate monopolies. Without these bottom-up experiments, the ""top-down"" regulations would lack a blueprint and face overwhelming lobbying resistance from incumbent industries.

### 2. The Necessity of the ""Top-Down"" (The Systemic Shift)
The ""High-Tech/Low-Tech"" balance cannot survive if global supply chains continue to optimize solely for planned obsolescence. For repairability to become a standard, we need:
*   **Right-to-Repair Legislation:** Legally forcing companies to provide schematics and parts.
*   **Extended Producer Responsibility (EPR):** Making companies financially and physically responsible for the end-of-life disposal of their goods.
*   **Carbon/Resource Taxes:** Shifting the burden of cost onto extractive industries so that ""new"" becomes more expensive than ""repaired.""

Without this top-down pressure, the Solarpunk lifestyle remains a luxury for those with the time and resources to opt out of the mainstream economy, rather than a systemic baseline for the average person.

### 3. The Neoliberal Paradox
Can this coexist with our current framework? **Only as a subculture.** 

If the goal is a fully Solarpunk society, the current globalized, ""growth-at-all-costs"" model must fundamentally evolve. Neoliberalism relies on **infinite expansion and consumer alienation.** Solarpunk relies on **circularity and individual competence.** You cannot ""scale"" Solarpunk while maintaining the profit margins required by modern shareholders. 

Therefore, Solarpunk isn't just an aesthetic; it is effectively **post-capitalist.** 

### The Pedagogical Implications
To your point on re-skilling: The ""literacy"" of the future looks a lot like the ""literacy"" of the pre-industrial artisan, but with added layers of science. It is **""Technological Stewardship.""**
*   **The Shift:** We move from being ""Users"" (passive consumers of an interface) to ""Stewards"" (active participants in the maintenance of a system). 
*   **The Result:** A society where mechanical empathy—the ability to look at a machine and understand its flow, its needs, and its limits—is as fundamental as literacy.

**The big question remains:** Does a transition this radical happen through a graceful evolution of policy, or does it require a ""collapse-to-regenerate"" scenario where the current brittle systems simply fail to sustain us, and Solarpunk becomes the only viable architecture for the aftermath? 

What is your take? Do you see this as a peaceful transition or an inevitable response to failure?"
