Role,Content
user,"Lets discuss The sustainability of the current global tourism model.
. What are your thoughts?"
model,"To analyze the sustainability of the current global tourism model, one must look beyond the immediate economic benefits—the GDP contributions and employment statistics—and examine the structural tension between **neoliberal expansionism** and the **biophysical limits of the planet.**

As a scholar observing this phenomenon, I categorize the crisis of contemporary tourism into four primary dialectical tensions:

### 1. The Paradox of ""Overtourism"" vs. The Right to Mobility
The current model is predicated on the democratization of travel, which has been accelerated by the proliferation of low-cost carriers and the ""platformization"" of accommodation (e.g., Airbnb). While this has opened the world to the middle classes of emerging economies, it has created a phenomenon of **spatial exhaustion.** Historic cities like Venice, Kyoto, and Barcelona are experiencing ""touristification,"" where the local urban fabric is hollowed out to serve a transient population. When a destination’s carrying capacity is breached, the model ceases to be sustainable not only ecologically but socially; it induces a xenophobic backlash and degrades the very ""authenticity"" the tourist sought to consume.

### 2. The Carbon Intensity of Distanced Tourism
The current global model is inextricably linked to the fossil fuel economy. Aviation remains one of the most difficult sectors to decarbonize. Even as the industry touts ""Sustainable Aviation Fuel"" (SAF) and carbon offsetting, these are frequently criticized as forms of *techno-optimism* that fail to address the fundamental problem: the sheer volume of long-haul travel. From a degrowth perspective, the current model relies on the assumption that we can decouple economic growth from carbon emissions. Evidence suggests this is a dangerous fallacy in the context of tourism, where the carbon footprint is largely generated by the distance traveled.

### 3. The Extraction of ""Experience Capital""
Tourism in the Global South often mirrors extractive colonial patterns. The ""leakage"" effect—where revenue generated from tourism in a developing nation flows back to multinational hotel chains, tour operators, and airlines based in the Global North—remains pervasive. Furthermore, the commodification of culture often leads to the sanitization of local traditions for the ""tourist gaze."" We are essentially exporting Western consumption patterns to fragile ecosystems and cultures, often leading to the displacement of indigenous peoples to make room for high-end ""eco-resorts,"" a practice I term **""Green-Colonialism.""**

### 4. The Resilience Vulnerability
The COVID-19 pandemic served as a brutal stress test that exposed the systemic fragility of the global tourism model. Destinations that had hitched their entire economic wagon to international tourism (e.g., Fiji, Maldives, or parts of the Caribbean) faced absolute collapse. A truly sustainable model would prioritize **diversification and localization.** We must move away from the ""growth-at-all-costs"" mindset toward a model of **regenerative tourism**—one that asks not just how many tourists we can accommodate, but how the presence of the visitor can actively improve the local ecology and social equity.

### Concluding Thoughts: Toward a ""Slow Tourism"" Paradigm
If we are to salvage the viability of global travel, we must undergo a paradigm shift:

*   **From Quantitative to Qualitative metrics:** We must stop measuring success by the number of arrivals and start measuring it by the ""net contribution to destination health.""
*   **Decoupling from Speed:** The ""slow travel"" movement is not merely a lifestyle trend; it is a structural necessity. Encouraging longer, fewer, and deeper engagements with a destination reduces carbon intensity and increases economic retention for the host community.
*   **The Internalization of Externalities:** If aviation and infrastructure costs reflected their true environmental damage, the current model would likely contract significantly. This is an uncomfortable truth for policymakers, but one that is mathematically inescapable.

In summary, the current global tourism model is **inherently unsustainable in its present velocity.** We are witnessing a phase shift where tourism must move from being an extractive industry to one that functions as a restorative force, or risk being forced into a contraction by the compounding pressures of climate change and social unrest.

**How do you view the ethical dilemma of the traveler? Is the individual consumer responsible for these structural failures, or is this a problem that can only be solved through supranational policy?**"
user,"It is intellectually fashionable to frame global tourism as a grand, systemic tragedy—a ""dialectic of neoliberalism"" played out on the stage of the Global South. While your analysis is structurally coherent and theoretically rigorous, I find myself deeply skeptical of the underlying assumptions here. 

You ask whether the burden lies with the individual consumer or the supranational policymaker. My skepticism begins with the premise that we are dealing with a ""crisis"" at all, rather than the inevitable, messy, and—dare I say—*productive* friction of global human integration.

### The Myth of the ""Innocent Traveler""
You characterize the traveler as a cog in a machine of ""extraction"" and ""green-colonialism."" This strikes me as a patronizing view of human agency. The traveler is not a passive vector of carbon, but an individual seeking the exact thing that has fueled human advancement for millennia: exposure to the ""other."" 

To suggest that the individual is somehow morally bankrupt for participating in a globalized world is to adopt a high-minded, ascetic posture that ignores why people travel. Is the aspiration for global mobility a ""neoliberal conceit,"" or is it simply an expression of an innate human desire to see the world before one dies? By framing the traveler as the culprit, you are essentially advocating for a new form of class-based gatekeeping—where only the elite can afford the ""slow travel"" tax, while the masses are told to stay home for the sake of the planet.

### The ""Decoupling"" Fallacy vs. The ""Efficiency"" Reality
You dismiss techno-optimism (SAF, carbon capture) as a ""dangerous fallacy."" I find this skepticism premature. The history of human development is a history of overcoming physical limits through technology. To assume that we have hit a wall—that the only path forward is ""contraction""—is the same Malthusian logic that has been proven wrong by every major economic advancement of the last century. 

Why must we assume that ""decoupling"" is impossible? Isn't it more likely that the solution lies in the radical innovation of energy, rather than the moral policing of human movement? The assumption that we must *shrink* to survive is a pessimistic worldview that ignores our capacity to innovate our way out of the carbon trap.

### The Neocolonial Savior Complex
You speak of ""regenerative tourism"" as if we can architect an industry that ""actively improves local ecology."" This sounds perilously like another form of top-down social engineering. Who defines what ""destination health"" looks like? Who decides which local traditions are ""authentic"" enough to be preserved? 

There is a distinct whiff of paternalism in the suggestion that the Global South needs to be guided toward ""sustainable"" models by Northern academics. Many of the nations you list—Fiji, the Maldives, the Caribbean—are clamoring for *more* tourism, not less. They see the economic revenue not as ""leakage,"" but as the primary ladder out of poverty. By advocating for ""contraction,"" aren't you essentially pulling the ladder up after you, all under the guise of ""sustainability""?

### The Verdict on Policy
To answer your final question: I am skeptical that either the individual or the policymaker can ""fix"" this, because I am not convinced that this is a system ""broken"" by failure, but a system functioning exactly as the global market intends. 

If we internalize the costs of aviation, prices will rise. If prices rise, the poor will stop traveling, and the rich will continue to fly on private jets, indifferent to the cost. The result? No net change in environmental impact, only a shift in the demographics of who gets to experience the world.

Instead of looking for a ""paradigm shift"" toward degrowth, we should be far more skeptical of the solutions being proposed. Are these ""structural changes"" actually concerned with the environment, or are they a mechanism to return to a pre-globalized world where travel is once again the exclusive purview of the aristocracy? 

I would argue that the ""uncomfortable truth"" isn't that tourism is unsustainable; it’s that we are terrified of a world where billions of people have the agency to participate in a global culture—and we are using ""sustainability"" as the moral justification to put them back in their place."
model,"Your counter-argument is both astute and necessary; you have identified a fundamental fault line in contemporary discourse—the point where environmental alarmism threatens to collide with the imperatives of equity, human agency, and historical development. By invoking the Malthusian trap and the specter of ""green gatekeeping,"" you challenge the moral authority of the ""degrowth"" perspective.

Let us dissect this skepticism, for it exposes the uncomfortable tension between **biophysical reality** and **liberal democratic rights.**

### 1. The ""Ladder of Development"" and the Charge of Paternalism
You raise a potent point regarding the ""pulling up the ladder"" effect. It is indeed a hallmark of Western intellectualism to advocate for ""sustainability"" after having already achieved a high standard of living through the very carbon-intensive industrialization we now seek to regulate in the Global South. 

If we argue that small island states should prioritize ""resilience"" over ""arrivals,"" we are essentially asking them to suppress their primary engine of capital accumulation. That is not merely a policy prescription; it is a profound moral imposition. If the Global South views tourism as a pathway to modernization, who are we—the comfortable observers—to classify that aspiration as a ""colonial pathology""? You are correct: the critique of ""leakage"" and ""extraction"" often ignores the agency of local populations who are actively choosing to participate in the global market to secure better health, education, and infrastructure.

### 2. The Limits of Technocracy vs. The Precautionary Principle
You challenge my dismissal of ""techno-optimism."" This touches upon the classic debate between **Cornucopianism** (the belief that technology can transcend resource limits) and **Ecological Economics** (which posits that there are absolute physical boundaries).

The skeptic’s view is that if we solve the carbon-intensity of flight (e.g., through hydrogen, advanced batteries, or synthetic fuels), the problem of tourism's ""sustainability"" evaporates. However, my scholar's concern—and where we might find common ground—is not just carbon. It is **space and metabolism.** Even if aviation were perfectly carbon-neutral tomorrow, does a city like Venice or a reef ecosystem in the Philippines have the infinite capacity to absorb the sheer volume of human bodies? The ""crisis"" here is not just chemical; it is topological. There are only so many historic piazzas and fragile atolls before the ""experience"" of tourism destroys the very object of the tourist’s desire. Is that a ""productive friction,"" or is that a terminal depletion of the cultural asset?

### 3. The Socio-Political Framing of ""Sustainability""
You suggest that ""sustainability"" is being repurposed as a mechanism for elite exclusion. This is a brilliant observation that aligns with the ""Great Stagnation"" thesis: as growth slows in the West, we seek to preserve our own quality of life by restricting the mobility of the global ""out-groups."" 

If ""sustainable tourism"" becomes a luxury brand—where only those with the capital to pay the ""carbon tax"" or the ""offset premium"" can visit Paris, Tokyo, or the Maldives—we have indeed moved from a meritocratic, globalized mobility to a neo-feudal model of travel. This is the ""hidden cost"" of the movement you rightly identify: **the democratization of travel is threatened by its own environmental externalities.** If we cannot fix the impact, the market will fix the price, and the price will serve as a gate.

### A Synthesis of the Conflict
Perhaps the disagreement lies in how we define ""success.""
*   If your definition of a successful global society is **maximum human integration, agency, and the pursuit of individual experience,** then the current model is a triumph of market efficiency, currently suffering from growing pains that technology will eventually smooth over.
*   If my definition of a successful society is **the preservation of systemic equilibrium and biodiversity,** then the current model is a reckless trajectory toward a ""tragedy of the commons"" where the physical world is effectively ""over-mined"" by the travel industry.

**My question back to you, then, is this:** If we reject ""contraction"" and ""moral policing,"" and we accept that the global population will continue to demand this level of mobility, what happens when the ""friction"" becomes catastrophic? 

If the cost of protecting these destinations—from rising seas, from over-crowding, from cultural erosion—starts to exceed the revenue they generate, does the ""market"" then decide to abandon them? Or do we, as a civilization, have an obligation to manage these spaces, even if that management *looks* like the very paternalism we both want to avoid? Is there a middle path that isn't just ""leave it to the markets"" or ""the scholars dictate the rules""?"
user,"Your synthesis pushes us past the binary of ""growth vs. degrowth"" and into the much more difficult territory of **stewardship vs. abandonment.** You ask if there is a ""middle path"" when the friction becomes catastrophe. As a skeptic, I find the premise of a ""middle path"" often functions as a intellectual crutch, but here it forces us to confront a reality that neither the eco-scholar nor the market-fetishist wants to admit: **The world is not a managed park; it is a wild, decaying, and chaotic system.**

To answer your question, we must address the ""management"" dilemma through three lenses of skepticism:

### 1. The Fallacy of the ""Managed Destination""
You ask if we have an ""obligation to manage these spaces."" This is where I am most skeptical. The moment we decide to ""manage"" Venice or the Great Barrier Reef, we move from being observers to being curators. A ""curated"" destination is, by definition, an open-air museum—or a theme park. 

The middle path you seek is likely to be a **shift toward exclusivity through natural selection.** If the costs of maintaining a destination (protecting a reef from bleaching, managing the sewage of millions in Venice) exceed the revenue, the market will not ""decide to abandon"" them; the *reality* of the environment will make them untenable. This is not a policy failure; it is the physical world reasserting its primacy. We cannot ""manage"" our way out of the degradation of a landscape any more than we can manage the weathering of a cliffside. 

Perhaps the middle path is simply **radical honesty:** We stop pretending that all destinations are ""forever"" resources and accept that human geography is transient.

### 2. The Decentralization of Experience
If we reject both top-down rationing (scholarly dictation) and the current ""over-tourism"" model, the only market-driven solution is **spatial diffusion.**

The ""overtourism"" crisis is fundamentally a clustering problem—everyone wants to see the same five monuments. We are witnessing an incredible, albeit messy, innovation in the travel sector: the gamification of the ""off-the-beaten-path."" From Instagram-driven micro-tourism to the growth of secondary and tertiary cities as hubs, the market is already trying to distribute the ""load."" 

Instead of asking how to ""manage"" these places, perhaps we should be skeptical of the desire to concentrate the global population in historic centers. The middle path here is not ""managing"" the tourist, but **de-centering the destination.** If the ""meritocracy of travel"" is to survive, it will be through the diversification of where humans derive their ""experience capital.""

### 3. The ""Obligation"" Trap
You ask if we have an obligation to intervene. I challenge the assumption that we are the *subjects* of this history. We are the *observers*. 

The desire to ""save"" these spaces is often a manifestation of the **""Museum Complex""**—the belief that the world should remain in a state of preservation that suits our current cultural aesthetic. But if the Maldives disappear, or if Kyoto loses its ""authenticity,"" that is not necessarily a systemic collapse; it is history. 

The middle path—the one that avoids both the tyranny of the scholar and the greed of the operator—is to **let the externalities be felt.** If air travel becomes prohibitively expensive, it won't be because a committee voted for it; it will be because the resource scarcity of the planet makes it so. If a destination becomes too expensive to visit due to the necessary infrastructure costs for climate adaptation, then it becomes a high-end experience for the few. 

**Is this ""fair""?** By the standards of 20th-century liberal democracy, no. But we are moving into an era where ""fairness"" is a luxury good. 

### My Final Skeptical Posture
I suspect the ""middle path"" you are looking for doesn't exist as a policy, but as an **adaptive behavior.** We will see the rise of ""fortress tourism"" (expensive, hyper-protected, limited) for the wealthy, and a retreat into local/regional tourism for the masses. 

My skepticism remains: why do we assume that a global, frictionless, egalitarian tourism model is a *natural state* that we must preserve? It was a brief, anomalous window made possible by cheap oil and a post-Cold War geopolitical vacuum. That window is closing. Trying to build a ""regenerative"" framework to keep the window open is a noble, if delusional, attempt to stop the tide. 

**Perhaps the most sustainable perspective is the one that accepts the contraction as inevitable, rather than trying to engineer a ""soft landing.""** Do we really have the right to curate the planet's future, or are we just the last generation of a specific, high-velocity era, trying to write the manual for the next one?"
model,"Your position, which I might categorize as a form of **""Entropic Realism,""** is a bracing corrective to the optimism of both the technocratic reformer and the social engineer. By stripping away the teleological assumption that global tourism is a ""right"" or a ""linear progress,"" you force us to look at the industry as what it likely is: a transient, fossil-fueled anomaly.

Your argument effectively dismantles the ""middle path"" as a conceit. If we accept your premise—that the ""golden age"" of mass mobility was a thermodynamic spike—then the discourse shifts from **""how do we fix it?""** to **""how do we experience the decline?""**

### The ""Museum Complex"" and the End of Curation
Your critique of the ""Museum Complex"" is perhaps the most profound point of our entire exchange. We have spent decades attempting to ""freeze"" the world in a state of consumable aesthetics—preserving Venice as a static artifact, keeping the Caribbean as a pristine postcard—while simultaneously flooding those spaces with the very volume of humanity that destroys their integrity.

If we drop the pretense of ""stewardship,"" we face a much more primal reality: **The end of universal access.** As you correctly note, if the ""friction"" of the climate and the cost of maintaining the infrastructure of global travel continue to rise, the market will naturally segment. We will see the return of the **Grand Tour model**—a luxury, time-intensive, and exclusionary pursuit—while the global middle class is effectively relegated to ""regional loops."" 

### The Shift from ""Global Citizen"" to ""Localized Observer""
If we accept that the high-velocity, globalized tourism era is closing, we must interrogate what follows:

1.  **The Rise of ""Fortress Tourism"":** As you suggested, we are already seeing the early stages of this. High-value, low-impact, hyper-policed enclaves for the wealthy will survive the transition. They will essentially function as walled gardens in a world where the ""common"" travel experience has become physically or economically impossible.
2.  **The Death of ""Universal Value"":** We are also witnessing the collapse of the idea that there is a ""world heritage"" that belongs to everyone. The struggle over who gets to see the Pyramids or the Taj Mahal will likely be replaced by a world where such experiences are mediated through digital proxies, and the physical act of visiting becomes an increasingly rare, expensive, and possibly politically restricted privilege.

### The ""Noble Delusion""
You ask if we have the right to curate the planet's future, or if we are merely the final generation of a high-velocity era. I suspect we are the latter. The ""sustainability"" movement is arguably the **final act of the modern project**—a desperate attempt to apply administrative logic to a system that is no longer responding to policy.

There is a tragic beauty in your perspective: that we should abandon the ""management"" of the planet and accept its chaotic, entropic path. But even the most die-hard skeptic must admit that there is a certain **melancholy** in the realization that the ""global integration"" we were promised in the 1990s is destined to become a period piece.

### A Final Question for the Skeptic
If we accept that the ""window"" is closing, and that we are essentially waiting for the return of ""aristocratic"" travel and the retreat of the masses to regional spheres, does this invalidate the **intrinsic value of the encounter** that we've had?

Was the period of global mobility a ""mistake"" because it was carbon-expensive, or was it a singular, precious moment of human curiosity that allowed for a level of cultural exchange that might not have been possible otherwise? 

If we are the last generation to ""see the world,"" does that make us the **keepers of the memory**, or merely the **witnesses to the closing of the curtain?** Your framework suggests the latter, and I find that perspective both intellectually honest and haunting."
