Role,Content
user,"Lets discuss The economics of free-to-play mobile games
. What are your thoughts?"
model,"The economics of free-to-play (F2P) mobile games revolve around a **high-volume, high-margin model** designed to convert a small percentage of users into ""whales.""

Here are the core pillars:

### 1. The Power Law (The 95/5 Rule)
F2P games rely on the vast majority of players (often >95%) playing for free. The game’s viability depends on a tiny fraction of ""whales""—high-spenders who account for the bulk of revenue. This makes **retention** the most critical metric; you cannot monetize players if they don't stick around.

### 2. Monetization Levers
*   **Microtransactions (MTX):** Selling convenience (energy refills), speed-ups, or cosmetic items.
*   **Ads:** Rewarded video ads (watching to get a perk) are the gold standard, as they don't break the user experience as harshly as forced interstitials.
*   **Gacha/Loot Boxes:** Exploiting dopamine loops via randomized rewards, which creates high variance in individual player spending.
*   **Battle Passes:** A recurring subscription-lite model that incentivizes daily login streaks.

### 3. The ""Cost of Acquisition"" (CAC) vs. LTV
The industry is a brutal math game:
*   **CAC (Cost to Acquire a Customer):** The cost of ads to get a user to download.
*   **LTV (Lifetime Value):** The total revenue a user generates before churning.
*   **The Goal:** If LTV > CAC, you scale the marketing budget. If not, the game dies. Because of rising ad costs, many games now focus on ""hyper-casual"" loops or deep social mechanics to drive organic growth.

### 4. Psychological Engineering
Game design is tethered to business goals. Mechanics like **Daily Login Bonuses, FOMO (Fear Of Missing Out), and ""Win-Loss"" streaks** are specifically designed to build habituation. The goal is to move the user from ""casual player"" to ""daily active user"" (DAU) and eventually to ""payer.""

### 5. Ethical Challenges
The model is increasingly criticized for:
*   **Predatory design:** Using gambling-like mechanics on vulnerable populations (children or those with addictive tendencies).
*   **""Pay-to-Win"":** Creating artificial friction that can only be overcome by spending, which degrades the actual quality of the game.

**My takeaway:** The F2P model turned gaming into a service industry. While it lowered the barrier to entry, it shifted the focus from ""creating a great experience"" to ""optimizing for conversion metrics,"" often at the expense of player enjoyment. 

What aspect of this model interests you most? The design psychology, the marketing side, or the ethics?"
user,"Your synthesis of the F2P landscape is sharp. It highlights a fascinating tension: the point at which **game design stops being about ""play"" and starts being about ""behavioral conditioning.""**

I am deeply drawn to the **design psychology** aspect, specifically the intersection of *operant conditioning* and *game mechanics.* 

What strikes me as most profound is the ""artificial friction"" you mentioned. In traditional game design, a developer might remove an obstacle if a player finds it frustrating. In the F2P model, that friction is the product itself—it is the item that is being sold back to the player in the form of ""convenience."" It is a bizarre inversion of value where the game is intentionally made *less fun* to manufacture a demand for the solution.

This leads me to a few questions that I’m curious to explore with you:

1.  **The ""Sunk Cost"" Trap:** How much of the whale’s spending is actually driven by enjoyment, and how much is driven by the desire to ""protect the investment"" of their time? When a player spends hundreds of hours (and dollars) on an account, does the game cease to be a hobby and become a **digital asset they are terrified to lose**?
2.  **The Evolution of the ""Whale"":** As players become more savvy to these mechanics, do you think we are seeing the emergence of ""ethical fatigue""? Is there a market gap for a high-quality game that explicitly rejects these loops, or is the ""free"" expectation so ingrained now that the premium model is effectively dead for mobile?
3.  **The Feedback Loop:** If we accept that game design is now tethered to conversion metrics, doesn't that inherently kill innovation? If a developer knows that a ""Gacha"" system yields X revenue, why would they ever take a creative risk on a new, unproven gameplay mechanic?

Which of those strikes you as the most significant hurdle for the future of the industry? Are we heading toward a world where mobile gaming is strictly ""content consumption"" rather than ""meaningful interaction""?"
model,"These are excellent questions that touch on the ""existential crisis"" of mobile gaming. To address your final point first: **I believe the most significant hurdle is the death of creative risk.**

When game design is subservient to the *Data Science* team, innovation becomes a threat. If a new mechanic is untested, it’s a variable that could disrupt the conversion funnel. This leads to the current ""reskinning"" culture—where developers take a proven, highly profitable math model and simply swap the art assets.

Let’s dig into your specific points:

### 1. The ""Sunk Cost"" Trap: Hobbies as Digital Real Estate
You’ve hit on a critical psychological pivot. When a player invests heavily, the game shifts from **""I play because I enjoy it""** to **""I play because I have equity in this.""**

*   **The Investment:** By spending $500, a whale isn't just buying digital items; they are buying social status within the game's ecosystem and a competitive advantage they don't want to forfeit.
*   **The Guardrails:** Many games leverage this by creating ""guilds"" or ""clans."" The social obligation (the ""you can't leave us, we have a raid tonight"") acts as a secondary layer of lock-in. The game ceases to be a recreational activity and becomes a **commitment**. If they quit, they lose the friends and the status they ""paid"" to build. It’s less like a hobby and more like a high-maintenance property investment.

### 2. The Evolution of the Whale: Ethical Fatigue?
The ""market gap"" you mentioned is real, but it’s fragile.
*   **The Premium Problem:** The ""free-to-play"" expectation is so deeply ingrained that consumers often view a $10, up-front premium game as ""expensive,"" while simultaneously dropping $20 a week on microtransactions without thinking. It’s a cognitive bias—small, incremental costs feel like ""participation,"" while a lump sum feels like an ""investment.""
*   **The Opportunity:** We are seeing a burgeoning market for ""Premium-Lite"" or ""Ethical"" models (like Apple Arcade or Netflix Games). These platforms pay developers a flat fee or based on engagement, allowing creators to make games without the ""artificial friction"" you identified. However, these rarely reach the astronomical revenue peaks of a predatory Gacha game. They exist on the periphery, catering to a shrinking demographic of ""players who still want to play.""

### 3. The Feedback Loop: The Death of the ""Play""
If we accept that mobile gaming is being optimized for **""Retention and Monetization,""** we are witnessing the migration of gaming away from art and toward **""interactive slot machines.""**

*   **Content vs. Interaction:** In a world of ""meaningful interaction,"" the player's agency is paramount. In the world of ""content consumption,"" the player's agency is a bug that needs to be managed. If a player is too smart or too skilled, they might beat the content without paying; therefore, the game must be tuned to stay just *slightly* out of reach, forcing the hand toward the wallet.

### Are we heading toward a world where mobile is just consumption?
Yes, for the mass market. The incentives are too skewed. As long as **Customer Acquisition Cost (CAC)** remains high due to aggressive competition for ad space, developers *must* use predatory loops to recoup costs.

**The irony:** By designing games that rely on behavioral conditioning rather than ""fun,"" the industry is training an entire generation of players to be ""gamers who hate the games they play."" 

The most exciting counter-movement—and perhaps the only way forward—is a split in the market: 
1.  **Mobile as a Utility/Service:** Purely for time-filling (the current status quo).
2.  **Mobile as a Premium Experience:** High-end devices (like the new iPhones or handhelds like the Steam Deck) are allowing mobile hardware to bridge the gap back to console-quality design, where the business model can finally return to ""pay for the product"" rather than ""pay for the escape from the friction.""

Do you think mobile hardware power is the only thing that can ""rescue"" mobile gaming design, or is the damage to the player psychology already too deep to undo?"
