Role,Content
user,"Lets discuss The science of alpine glacial moraine internal core degradation monitoring sensors
. What are your thoughts?"
model,"Monitoring internal moraine core degradation is critical for assessing geohazard risks—specifically **Glacial Lake Outburst Floods (GLOFs)**—as climate change accelerates ice core melting.

The science focuses on overcoming the extreme challenges of remote, high-altitude, and rugged environments. Here are the key technical pillars:

### 1. Sensing Modalities
Because these cores are buried under meters of debris, surface observations are insufficient.
*   **Geophysical Tomography:** **Electrical Resistivity Tomography (ERT)** is the gold standard. Since ice has high resistivity and water/sediment have low resistivity, multi-electrode arrays can map the internal ""melt-front"" evolution over time.
*   **Thermal Profiling:** Deploying **thermistor strings** into boreholes to monitor heat flux. This identifies whether melting is driven by atmospheric warming (conduction from the surface) or latent heat from internal groundwater flow.
*   **Pore-Water Pressure Sensors:** Vital for slope stability. These detect increases in interstitial pressure, which often precede catastrophic slope failure or moraine breaching.

### 2. Emerging Technologies
*   **Fiber-Optic Sensing (DTS):** Distributed Temperature Sensing using fiber-optic cables can provide high-resolution, continuous temperature data along an entire borehole, offering a 1D profile of internal thermal degradation superior to point-source sensors.
*   **InSAR & UAV Photogrammetry:** While not ""internal,"" these provide the structural context. Satellite-based Interferometric Synthetic Aperture Radar (InSAR) monitors millimetric surface deformation, which often acts as a proxy for subsurface ice loss.
*   **Passive Seismic/Acoustic Monitoring:** Detecting the ""micro-seismic"" signature of ice-core cracking or subsurface water movement (piping) before a visible breach occurs.

### 3. Engineering Challenges
*   **Power Management:** Remote locations require robust solar arrays and high-capacity battery buffers designed to survive sub-zero temperatures and high wind loads.
*   **Data Telemetry:** High mountains often lack cellular coverage. Systems rely on **Iridium satellite links** or **LoRaWAN mesh networks** to relay data from deep valleys to base stations.
*   **Durability (Creep):** The biggest mechanical challenge is **glacial creep**. Sensors and casings must withstand the constant, slow deformation of the debris matrix without shearing or drifting out of position.

### 4. The Data Synthesis
The current scientific frontier is **""Digital Twin"" modeling**. By feeding real-time sensor data into 3D thermo-mechanical numerical models, researchers can simulate how current melt rates will impact the mechanical stability of the dam over 5–10 year horizons.

**My take:** We are moving from reactive monitoring (post-event) to predictive modeling. The bottleneck isn't the sensing hardware, but the **spatial sparsity**. Because moraines are heterogeneous, one sensor string can miss an entire internal ""hotspot."" The future lies in lower-cost, wireless, ""deploy-and-forget"" sensor nodes that can be installed in larger networks.

Are you looking at this from a geological survey perspective, or are you interested in the hardware/sensor development side?"
user,"Your analysis of the transition from reactive to predictive monitoring is sharp, and it highlights a fundamental tension in geosciences: the gap between our high-fidelity, site-specific instrumentation and the stochastic, heterogeneous nature of the terrain.

To answer your question, my interest lies at the intersection of **the physics of ""non-invasive"" deep-earth sensing and the scalability of the sensor network architecture.**

If we are moving toward your proposed ""deploy-and-forget"" model, I find myself lingering on three specific ""inquisitive"" hurdles that I’d love your take on:

### 1. The Energy-Density/Durability Paradox
You mentioned the ""deploy-and-forget"" goal. If we want high-resolution spatial coverage, we need hundreds of nodes. But in a high-alpine moraine, energy harvesting is unreliable (winter cloud cover, snow burial of panels), and battery chemistry suffers in the cold.
*   **The Question:** Do you foresee us moving toward **energy-harvesting transducers** (e.g., scavenging power from the thermal gradient between the surface and the cold core, or from the mechanical stress of glacial creep) to sustain these nodes, or is the future purely a move toward **ultra-low-power, ""event-driven"" sensing** that only wakes up when a threshold is breached?

### 2. The ""Heterogeneity"" Problem
You are absolutely right that a single sensor string often misses the ""hotspot."" If we deploy a mesh network of lower-cost sensors, we lose the deep-trench insights provided by ERT or thermistor strings.
*   **The Question:** How do we effectively use **stochastic inversion** to correlate the data from a high-density, low-fidelity mesh of surface/near-surface sensors with the sparse, high-fidelity deep-borehole data? Can we effectively ""interpolate"" the subsurface condition using machine learning on the surface-deformation/acoustic signatures, or does the complex internal structure of a moraine make that mathematically unreliable?

### 3. The ""Creep"" Signal vs. Noise
If we are using passive seismic monitoring to detect ""piping"" or ice-cracking, we are working in an incredibly noisy environment. Wind, rockfall, and tectonic background noise are constant.
*   **The Question:** Are there specific **acoustic signatures or frequency bands** that you consider ""the holy grail"" for distinguishing benign glacial creep from the imminent structural failure of an ice core? Is there an emerging consensus on what the ""pre-collapse"" sound actually looks like?

I’m particularly intrigued by your mention of **Digital Twins**. We are essentially talking about creating a ""weather forecast"" for a dam that is actively liquefying from the inside out. In your view, is the current numerical modeling software actually capable of handling the fluid-dynamics of the melt-water *within* that debris matrix, or are our models still too idealized to be truly predictive?"
model,"These three hurdles define the current ""bleeding edge"" of cryospheric instrumentation. You’ve hit on the exact points where physics, signal processing, and geotechnical engineering collide.

### 1. The Energy-Density/Durability Paradox
I believe the future is **event-driven, ""edge-computed"" intelligence** rather than persistent high-power sensing. 
*   **Harvesting Limits:** Thermal gradient scavenging (Seebeck effect) is notoriously inefficient in moraines because the entire environment tends toward isothermal conditions during the critical melt season. Mechanical scavenging (creep) is difficult to implement without becoming a mechanical point of failure.
*   **The Path Forward:** The future is **low-power, event-triggered wake-up circuits.** If we use low-power geophones or piezoelectric sensors that function as ""passive"" triggers, we can keep the high-power telemetry and data-processing chips in a deep-sleep state. The node only ""wakes up"" when the spectral signature crosses a specific threshold. This shifts the energy burden from *constant acquisition* to *transient processing*, extending field life from months to years.

### 2. The Heterogeneity/Stochastic Inversion Problem
Mathematical unreliability is the major risk here. The debris matrix is effectively a chaotic, porous medium.
*   **The ""Surrogate Model"" Approach:** We cannot rely on direct interpolation. Instead, the industry is shifting toward **Physics-Informed Neural Networks (PINNs).** By training models on the high-fidelity ERT/borehole data (the ""ground truth"") and using the low-fidelity mesh as the ""input field,"" we can constrain the neural network using the laws of fluid dynamics and heat transfer.
*   **The ""Virtual Sensor"" Strategy:** Instead of asking the network to interpolate, we use the sparse high-fidelity nodes to calibrate the ""noise"" (surface deformations) detected by the high-density low-fidelity nodes. In this sense, the low-fidelity network doesn't ""map"" the subsurface; it acts as a **distributed sensor array for surface-expression proxies** that are mathematically tethered to the deep-core dynamics.

### 3. The ""Holy Grail"" Signal (Creep vs. Piping)
This is the hardest nut to crack. Distinguishing between benign glacial shifting and the ""piping"" that causes GLOF events is essentially a **signal separation problem.**
*   **The Signature:** Benign creep is generally low-frequency, impulsive, and stochastic. Piping (the movement of pressurized water through the debris) creates a **continuous, broadband ""hiss"" or ""hum""** (often in the 50Hz–200Hz range) caused by fluid turbulence against rock walls.
*   **The ""Pre-Collapse"" Indicator:** The most promising signal is **spectral whitening.** As an ice-core pore network begins to transition from isolated pockets to a connected conduit (the precursor to a breach), the acoustic noise floor shifts. We are looking for an increase in the high-frequency components of the seismic spectrum, indicating high-velocity fluid flow within the moraine. If we see a surge in the 100Hz+ range while low-frequency creep remains constant, that is your ""red alert.""

### Is the Digital Twin capable of fluid-dynamics modeling?
In its current state: **No, not at the scale of an entire moraine.**
Current codes like *GeoStudio* or *RS3* handle Darcy-flow through porous media well, but they struggle with **internal conduit development**—the ""pipe"" phenomenon where a small melt channel grows exponentially due to thermal feedback (the more water flows, the more ice melts, the bigger the channel gets).

We are currently forced to use **representative elementary volumes (REV)**, which smooth over the very heterogeneities that lead to failure. To achieve truly predictive modeling, we need to move toward **coupled thermo-hydro-mechanical (THM) solvers** that can handle non-linear crack propagation. We are currently at the ""weather forecast"" stage—we can predict the general trend of stability, but we cannot yet predict the ""lightning strike"" (a localized breach) with high certainty.

**My question to you:** If we accept that we cannot perfectly model the internal pore-space, should we prioritize **high-density, low-fidelity monitoring** to capture the ""event,"" or continue fighting for the **high-fidelity ""Deep Insights""** that define the physics of the melt? Which gives the disaster-management teams more actionable intel?"
