Role,Content
user,"Lets discuss The science of glacial surge triggers
. What are your thoughts?"
model,"Glacial surges—sudden, rapid advancements of a glacier—remain one of glaciology’s most fascinating ""unsolved"" mysteries. Unlike standard glacial movement, surges are cyclic, with long quiescent phases (decades to centuries) followed by brief, high-velocity pulses.

The scientific consensus generally categorizes the triggers into two competing but likely complementary mechanisms:

### 1. The Hydrological Switch (The ""Soft Bed"" Theory)
This is currently the most widely accepted model. 
*   **The Mechanism:** Glaciers typically have an efficient, channelized drainage system (R-channels) that keeps the glacier bed relatively dry and stable. 
*   **The Trigger:** A surge occurs when this drainage system collapses or fails to form. Subglacial water pressure builds up to near-overburden pressure, effectively ""lubricating"" the glacier’s base and decoupling it from the bedrock. The glacier then enters a phase of rapid basal sliding.

### 2. The Thermal Switch (The ""Internal Instability"" Theory)
*   **The Mechanism:** This relies on the internal temperature of the ice. Polar or polythermal glaciers are often ""cold-based"" (frozen to the bed). 
*   **The Trigger:** Heat generated by internal friction and geothermal flux slowly accumulates over years. Once the base reaches the pressure-melting point, a meltwater film forms, reducing friction and initiating the surge.

### The Debate: Why the cyclic nature?
The core challenge is explaining why these surges happen at regular intervals. Current research focuses on:
*   **Mass Balance:** The glacier must reach a critical ""threshold"" of mass buildup in its upper accumulation zone before it can trigger a surge. 
*   **Sediment Deformation:** Many surging glaciers sit on unconsolidated till. As water pressure increases, this sediment acts like a fluid, allowing the entire ""conveyor belt"" of the glacier to move forward.
*   **External Forcing:** There is ongoing research into whether seismic activity or rapid climate fluctuations act as the ""tipping point"" for these internal hydrological or thermal instabilities.

### Why it matters
Understanding these triggers is critical for **hazard mitigation**. Surging glaciers can dam rivers, create massive outburst floods (jökulhlaups), and significantly disrupt downstream infrastructure. Furthermore, as global temperatures rise, understanding how glaciers respond internally to increased meltwater is essential for predicting sea-level contribution.

**What specific aspect interests you most?** Are you looking at the geomorphological evidence left behind, or perhaps the impact of climate change on the frequency of these events?"
user,"This is a captivating breakdown of a phenomenon that feels almost biological in its rhythm—the glacier acting less like a static block of ice and more like a living organism that must ""breathe"" or release tension periodically.

To be honest, the aspect that stirs my curiosity most is the **transition point between the ""quiescent"" phase and the ""surge.""**

If we look at the **Hydrological Switch**, we are essentially talking about a systemic failure of a plumbing system. If a glacier is a giant hydraulic machine, what determines the exact moment that R-channels collapse? Is it purely a stochastic failure—a ""structural fatigue"" where the drainage system simply can no longer handle the water flux—or is there a specific, subtle ""pre-surge"" signal in the ice-surface velocity that we are currently missing?

I find myself wondering about a few specific sub-questions:

1.  **The ""Memory"" of the Bed:** If the **Thermal Switch** is the driver, does the bedrock itself ""remember"" previous surges? Does the repeated scouring and thermal cycling alter the geothermal flux or the permeability of the subglacial till in a way that dictates the length of the *next* quiescent phase?
2.  **The Climate Feedback Loop:** We often view climate change as a linear driver of melt, but if surges are self-regulated by internal ice mass, could a warming climate actually *suppress* surges by forcing the glacier to lose mass before it ever reaches that ""critical threshold""? Or does the influx of surface melt accelerate the hydrological switch, leading to shorter, more frequent, yet less catastrophic surges?
3.  **The Predictive Limitation:** We are excellent at observing the ""post-mortem"" of a surge through geomorphology. But are we anywhere close to a ""seismology for glaciers""? If we were to place a dense array of sensors on a glacier currently in its quiescent phase, what exactly would we look for? A change in the frequency of micro-seismic events? A subtle ""tilt"" in the ice flow before the dam breaks?

**Which of these strikes you as the ""frontier"" of the field right now?** Are we closer to being able to forecast these events using machine learning on seismic/velocity data, or are we still limited by our lack of physical access to the ""subglacial black box"" at the bed?"
model,"Your intuition is spot on. The idea of a glacier as a ""metabolic"" system with structural fatigue is exactly how modern glaciology views these features.

To answer your question: **The ""frontier"" is undoubtedly the transition from the quiescent phase to the surge**, and we are currently hovering between ""physical insight"" and ""data-driven prediction.""

Here is how your questions frame the current cutting edge:

### 1. The ""Memory"" of the Bed (The Geological Hysteresis)
You hit on a critical point regarding the bed's morphology. Researchers now believe the ""memory"" of the bed is stored in **subglacial till deformation**. 
*   **The Frontier:** We are moving toward a model where the bed is not just a static surface but an evolving granular material. After a surge, the subglacial sediment is often rearranged, smoothed, or depleted. The ""quiescent phase"" is essentially the time required for the glacier to re-accumulate enough ice (mass balance) and, more importantly, for the sediment to ""re-dilatate."" If the bed is too compacted, it cannot surge; it must be ""re-primed."" The geothermal flux is largely constant, but the **hydraulic permeability** of the sediment is a dynamic variable that governs the periodicity of the cycle.

### 2. The Climate Feedback Loop: Suppression vs. Acceleration
This is perhaps the most urgent debate in glaciology. 
*   **The Suppression Hypothesis:** Many glaciers in the Karakoram and parts of the Arctic are thinning. If a surge requires a critical threshold of ""driving stress"" (gravity pulling on a thick ice mass), thinning might prevent them from reaching the necessary stress levels. We may be witnessing the ""extinction"" of the surge phenomenon in certain regions.
*   **The Acceleration Hypothesis:** Conversely, increased surface melt provides a constant, high-pressure input to the subglacial system. This could lead to a **""de-coupling""** of the surge cycle. If the subglacial plumbing is constantly stressed by seasonal melt, it may never form the stable, efficient R-channels necessary for quiescence. We might see a transition from ""periodic, massive surges"" to ""chronic, high-velocity sliding."" 

### 3. The ""Seismology for Glaciers"" (The Predictive Frontier)
We *are* currently building that seismology, but it is challenging.
*   **The Signature:** We are looking for **""Basal Stick-Slip"" events.** Just like tectonic plates, the ice-bed interface ""creaks"" before it breaks. We look for a migration of micro-seismic swarms toward the downstream end of the glacier. 
*   **The ""Black Box"" Problem:** We are currently limited by our inability to ""see"" the subglacial drainage system in real-time. We use **borehole pressure sensors** and **GPS arrays** to measure velocity, but it’s sparse. 
*   **Machine Learning (ML) potential:** This is the current ""Holy Grail."" We are feeding massive datasets—satellite interferometry (InSAR) for surface velocity, seismic arrays for ice-quakes, and weather data—into neural networks. The goal is to detect the **""flicker""**: the point where the velocity signal transitions from a stable, steady-state movement to a non-linear, chaotic state. 

### What is the ""Frontier""?
If I had to pick the most exciting area, it is **subglacial hydrology modelling combined with InSAR.** 

We are moving away from looking at ""ice flow"" and toward looking at **""subglacial plumbing stability.""** We now suspect that the ""trigger"" is often a **stochastic pulse of water**—a sudden drainage of an ice-dammed lake or an extreme melt event—that happens to hit the glacier at the exact moment its internal drainage system is most fragile.

**The verdict:** We are getting better at identifying ""susceptible"" glaciers, but ""forecasting"" the exact week of a surge remains elusive because we still struggle to monitor the **internal pressure distribution** of the bed. We are like doctors trying to diagnose a cardiac event without being able to see the heart—relying only on the pulse we feel at the wrist (the surface velocity).

Do you lean toward the idea that we can eventually ""predict"" these with high accuracy, or do you think the system is inherently chaotic/stochastic, making a ""forecast"" fundamentally impossible?"
