Role,Content
user,"Lets discuss The aesthetics of solarpunk urban planning
. What are your thoughts?"
model,"Solarpunk urban planning prioritizes the integration of **high-tech sustainability with lush, organic biology.** It moves away from the sterile, concrete-heavy aesthetics of modernist planning in favor of a ""living city"" model.

Key aesthetic pillars include:

*   **Biophilic Integration:** Buildings are not just *in* nature; they incorporate it. This manifests as vertical forests, extensive green roofs, hydroponic facades, and interiors that blur the boundary between indoor and outdoor spaces.
*   **Technological Optimism (Appropriate Tech):** Infrastructure is visible but harmonious. Think solar shingles that resemble traditional tiles, integrated wind turbines designed as sculptural elements, and rainwater harvesting systems that become aesthetic water features.
*   **Human-Scale Design:** The ""15-minute city"" concept is central. Urban layouts favor walkability, cycling, and communal transit over personal vehicle ownership, allowing streets to be reclaimed as parks, plazas, and markets rather than traffic corridors.
*   **Materials and Textures:** A departure from grey concrete toward sustainable, high-performance materials like mass timber (CLT), rammed earth, and recycled modular components, often accented by warmer, artisanal touches.
*   **Adaptive Reuse:** Solarpunk celebrates the ""patchwork"" aesthetic—retrofitting existing industrial structures with modern, sustainable tech rather than tearing them down. This preserves cultural history while reducing construction carbon.

**The core tension:** The aesthetic challenge is to avoid ""greenwashing"" or ""eco-kitsch."" True solarpunk urbanism isn't just a building covered in ivy; it’s a functional, resilient ecosystem where the beauty is a byproduct of its ability to produce energy, clean water, and food for its residents. 

Do you see this as a realistic evolution of our current cities, or more of a utopian architectural exercise?"
user,"To ponder this is to weigh the difference between **architectural aesthetics** and **systemic metabolism.**

When I look at the Solarpunk vision, I am struck by a fundamental question: Is the aesthetic of the ""living city"" an inevitable consequence of resource scarcity, or is it an indulgence that requires a surplus of wealth we may soon lose?

Here is my breakdown of where this vision sits between ""inevitable evolution"" and ""utopian fantasy.""

### 1. The ""Path of Least Resistance"" (Evolutionary Reality)
I see the transition to Solarpunk features as highly realistic—not because of idealism, but because of **thermodynamic necessity.**

*   **Adaptive Reuse is the future of economics:** As the cost of raw materials and the carbon footprint of demolition rise, retrofitting (the ""patchwork aesthetic"") will become the most financially viable path. We are already seeing older industrial warehouses being retrofitted with mass timber interiors and smart-glass windows. This isn’t just aesthetic; it’s fiscal prudence.
*   **Biophilic Cooling:** As global temperatures rise, the ""Urban Heat Island"" effect is becoming a lethal threat to city infrastructure. Vertical forests and green roofs are shifting from ""luxury design elements"" to ""passive cooling necessities."" When biology performs a service (lowering air conditioning costs and managing stormwater), it ceases to be ""kitsch"" and becomes infrastructure.

### 2. The ""Infrastructure-Architecture"" Gap (The Utopian Hurdle)
Where the vision borders on utopianism is in the **integration of appropriate tech.** 

*   **The Maintenance Paradox:** A solar-shingle roof is beautiful, but it requires a level of decentralized maintenance that current municipal models aren't built for. Who maintains the vertical forest if the irrigation sensors fail? Who cleans the sculptural wind turbines? Solarpunk assumes a high level of civic engagement and ""maintenance culture""—a trait that has been eroded by 20th-century consumerism. 
*   **The Scale Problem:** The ""15-minute city"" is a dream for developers, but it is a nightmare for existing, car-dependent, sprawling urban topologies (like those in North America). To reach a Solarpunk state, you don't just need new buildings; you need to rip out the arterial road networks that define our current urban geography. That is not just architectural—it is a social and political revolution.

### 3. The ""Eco-Kitsch"" Trap
You hit on the most critical point: the danger of greenwashing. 

If we build a glass-and-steel skyscraper and slap a few planter boxes on the balcony, we have created a ""green-washed relic."" True Solarpunk requires a **circular metabolism.** A building must produce more energy than it consumes, or at the very least, be part of a micro-grid. 

If the beauty is just a decorative ""skin,"" it is unsustainable because it adds maintenance costs without providing the resilience that defines the movement. **The beauty must be the utility.** If the solar array is sculptural *because* it must track the sun at a specific angle to maximize efficiency, then the beauty is honest. If it is sculptural for the sake of being pretty, it is a failure.

### My Question for You:
If we accept that Solarpunk is a transition from a *consumption-based* city to a *production-based* city, do you think our current legislative structures—zoning laws, building codes, and property tax models—are capable of supporting this? 

Or, are we looking at a future where cities must *collapse* or undergo a radical crisis before they are allowed to shed the current ""concrete-heavy"" regulations that forbid the very integration you describe?"
model,"Your analysis cuts to the heart of the matter: **the conflict between the static nature of our legal systems and the fluid, metabolic nature of a Solarpunk city.**

To your question: **Our current legislative structures are fundamentally incompatible with a production-based city.**

Here is why our current frameworks act as ""architectural drag"":

### 1. The Zoning Trap: Segregation vs. Metabolism
Modern zoning (Euclidean zoning) is built on the philosophy of **separating incompatible uses.** It treats the city like a machine with isolated parts: residence here, commerce there, industry far away. 

Solarpunk requires the *mixing* of these functions. You cannot have a productive, metabolic city if your building code prohibits a small-scale aquaponics system or a localized energy micro-grid within a residential zone. We have legally codified ""living"" out of our neighborhoods. To transition, we would need to move toward **performance-based zoning**, where a building is allowed to be whatever it needs to be, provided it meets net-zero carbon, water, and energy targets.

### 2. The Liability of Maintenance (The ""Maintenance Paradox"")
You hit the nail on the head: Solarpunk requires a culture of ""stewardship"" rather than ""ownership."" 

Current municipal laws are designed to offload liability. If a developer builds a vertical forest, they are often legally responsible for the ""safety"" of those plants (e.g., falling branches, irrigation leaks causing mold, pests). Insurance models and building codes are so risk-averse that they essentially mandate the ""concrete-and-glass"" aesthetic because it is the only thing that is reliably ""predictable."" 

Until we shift the legal definition of a building from a ""static asset"" to an ""active ecological participant,"" innovators will continue to be penalized by insurance premiums and code enforcement.

### 3. The Collapse vs. Reform Debate
Are we looking at reform or collapse? I lean toward **""Crisis-Driven Adaptation.""**

*   **The Reform path:** Is glacially slow. It relies on the slow adoption of green building standards (like LEED or Living Building Challenge) which are still largely performative rather than metabolic.
*   **The ""Crisis"" path:** Cities are already reaching a breaking point with heat islands and infrastructure maintenance costs. I suspect we will see ""Solarpunk enclaves""—specific, city-sanctioned experimental zones or private developments that are granted immunity from standard zoning codes because they solve local crises (energy grid failure or water scarcity) that the city cannot solve itself. 

### The Shift in Power
The most radical change isn't the architecture; it's the **ownership of the utility.** 

In a Solarpunk city, the building is the utility. If I am the owner of a building that creates its own power and manages its own waste, I am no longer a dependent subject of the municipal grid. Governments are generally resistant to this, as it erodes the tax base and control mechanisms. 

**My conclusion:** We won't get a Solarpunk city through ""zoning reform."" We will get it when the **cost of maintaining our current industrial sprawl exceeds the cost of decentralization.** We are currently paying for the ""stability"" of the old model; when that price becomes higher than the cost of the ""new"" model, the regulations will be rewritten—often by necessity, not by design.

Do you think the ""Maintenance Culture"" you mentioned is something that can be learned, or does the success of this vision require a total shift in how we define property rights?"
