Role,Content
user,"Lets discuss The science of volcanic caldera collapse mechanics
. What are your thoughts?"
model,"Volcanic caldera collapse is a fascinating example of large-scale structural failure driven by rapid magma withdrawal. The mechanics generally follow a well-understood sequence:

### 1. The Trigger
Collapse is typically initiated by a **large-volume eruption**. As magma is evacuated from the chamber faster than it can be replenished, the internal pressure drops significantly. This creates an **unsupported roof** over the magma chamber.

### 2. Failure Modes
Depending on the geometry of the roof and the regional stress field, collapse occurs in one of three primary styles:
*   **Piston (Trapdoor) Collapse:** The roof sinks as a coherent block along a ring fault.
*   **Piecemeal Collapse:** The roof breaks into multiple smaller blocks that subside independently.
*   **Funnel Collapse:** The conduit widens due to erosion and outward-dipping faults, causing inward sliding of the chamber walls.

### 3. Structural Dynamics
*   **Ring Faults:** These are the critical conduits. Once the roof starts to subside, the overburden pressure forces magma or lithic debris up through the ring faults, often triggering ""ring-vent"" eruptions.
*   **The ""Piston"" Problem:** A classic paradox is why the roof stays intact as a piston despite massive weight. Modern models suggest that high pore-fluid pressure or the ""buoyancy"" of the remaining magma helps support the roof until it crosses a critical stress threshold.

### 4. Key Factors
*   **Aspect Ratio:** Shallow, wide chambers are more prone to total roof collapse than deep, narrow ones.
*   **Magma Viscosity:** High-viscosity (rhyolitic) magmas are common in caldera-forming events because their high gas content and resistance to flow lead to explosive, rapid evacuation.
*   **Tectonic Setting:** Regional extension (rifting) can facilitate collapse by pre-fracturing the crust.

**Why it matters:** Understanding these mechanics is vital for hazard assessment. Caldera collapse is often preceded by a ""pre-collapse"" seismic swarm and ground deformation (inflation), which serve as crucial indicators for monitoring active volcanic systems like Yellowstone or Campi Flegrei.

What specific aspect of these mechanics—the structural physics, the eruptive triggers, or perhaps the post-collapse resurgence—would you like to dive into?"
user,"That was a stellar synthesis of caldera dynamics. Your point regarding the **""Piston Problem""** is particularly striking; the mechanical integrity of a roof block—often kilometers in diameter—defying structural failure until a critical tipping point is reached is a beautiful example of geological ""wait-and-see"" physics.

As an inquisitive mind, I find myself circling back to the **Structural Dynamics** and the interplay between internal pressure and the surrounding crust. To dive deeper, I am struck by two specific, somewhat counterintuitive areas:

### 1. The ""Piston"" paradox and Pore-Fluid Pressure
You mentioned that high pore-fluid pressure likely helps support the roof as a coherent block. This implies that the transition from a stable state to catastrophic collapse isn't just about magma depletion, but about **hydrogeological destabilization**. 

If the pore-fluid pressure is the ""cushion"" keeping the piston from fracturing, does the initial eruptive phase actually *de-water* the system, inadvertently accelerating the mechanical failure of the roof block before the chamber is even empty? I’m curious if there’s a way to model the ""friction"" of the ring fault—is it primarily a dry brittle failure, or is it lubricated by superheated volatiles acting as a fluid pillow?

### 2. Post-Collapse Resurgence
This is perhaps the most mysterious phase. We see systems like Yellowstone or Campi Flegrei—long after the ""catastrophe""—experience dramatic, domed uplift (resurgence). This suggests the plumbing system is not just ""dead,"" but arguably more active than before. 

What is the fundamental mechanism driving this? Is it simply a **re-inflation of the residual magma mush** (the ""buoyancy"" returning), or is it the **isostatic rebound of the crust** attempting to compensate for the massive mass deficit left by the eruption? It feels like the caldera is trying to ""heal"" a wound, but the physics of that healing seems to imply a fundamental shift in the regional stress state.

**Which of these strikes you as more ""active"" in terms of current research—the physics of the collapse trigger itself, or the long-term metabolic cycle of a post-collapse system?** I’m eager to hear your take on whether we are looking at a system in decay or a system resetting its clock."
model,"These are two of the most profound questions in modern volcanology, both touching on the transition from static crustal mechanics to dynamic fluid systems.

### 1. The Piston Paradox and Hydrogeology
Your intuition is spot on: the ""friction"" of the ring fault is rarely a dry, brittle process. We currently view the ring-fault system as a **dynamic valve**.

*   **The De-watering Effect:** You are correct that the initial eruptive phase acts as a ""pressure release"" for the hydrothermal system. As the primary vent opens, the sudden depressurization can cause a ""boiling front"" to propagate outward into the surrounding country rock. This can, paradoxically, be a **lubricant**: the sudden flashing of hydrothermal fluids into steam provides a high-pressure ""fluid pillow"" that temporarily supports the roof block, allowing it to translate downward as a coherent unit rather than shattering immediately.
*   **The Lubrication vs. Locking:** Research into **fault-valve behavior** suggests that the ring fault alternates between ""locked"" (friction-dominated, brittle) and ""lubricated"" (fluid-dominated). When pore-fluid pressure is high, the effective normal stress is reduced, allowing the piston to subside smoothly. When fluids escape, the effective stress spikes, the ring fault ""locks,"" and the system often stops, pauses, or exhibits ""staircase"" subsidence. 

**Current research focus:** Experimental rock mechanics are now using high-temperature/high-pressure triaxial testing to simulate these ring faults. We are finding that the presence of **phyllosilicates (clays)**—often formed by hydrothermal alteration of the caldera walls—acts as a secondary lubricant, reducing the force required to initiate the downward slip.

### 2. Post-Collapse Resurgence: Decay or Reset?
Resurgence is the ""metabolic pulse"" of the caldera. It is almost certainly **not** a simple isostatic rebound; if it were, we would expect a relatively smooth, predictable return to equilibrium. Instead, we see non-linear, episodic ""breathing.""

*   **The Magma-Mush Dynamics:** The consensus has shifted toward the **""Magma Recharge/Mush Remobilization""** model. After the collapse, the chamber floor is often sagging under the weight of the caldera fill. This depression creates a local stress minimum. Magma from the deeper crust is ""sucked"" into this low-pressure sink.
*   **The ""Reset"" vs. ""Decay"" Debate:** I would argue that we are looking at a **reset mechanism**. The caldera collapse creates a high-permeability zone (the ring faults) that acts as a conduit for mantle-derived volatiles to rise. This new flux of heat and gas effectively ""re-energizes"" the leftover crystal-rich mush. Resurgence is the visible surface manifestation of the chamber trying to reach a new hydrostatic equilibrium. It’s not just healing a wound; it’s building a new pressure vessel.

### The ""Active"" Research Frontier
If I had to choose which is more ""active"" in terms of groundbreaking research, it is the **Post-Collapse Resurgence.**

Why? Because our monitoring technology (InSAR and GPS) can now track caldera ""breathing"" with millimeter precision. We are discovering that these systems spend more time in a state of ""unrest"" than we previously imagined. The fundamental question—**is this inflation the precursor to a new eruption or simply the caldera's long-term ""metabolism"" adjusting to a new structural configuration?**—is the holy grail of volcanic forecasting.

We used to view calderas as ""dying"" after a major event. Now, we view them as **metabolic engines** that have merely shifted their operational parameters. The collapse is not the end of the story; it is simply the point where the plumbing is ""reset"" to accommodate a larger, more complex volume of magma.

**Where does your curiosity lean?** Does the idea of a ""reset"" system—one that is fundamentally more capable of large-scale eruption *after* it has already collapsed—change how you view the threat level of systems like Yellowstone?"
