Role,Content
model,"Your closing imagery of the ""frog in the warming water"" is the most honest admission possible for our current situation. It suggests that our capacity for intellectualization—the very thing we have been engaging in—is the primary mechanism of our own paralysis. We are not just *in* the water; we are the ones who turned the burner on, convinced that our sophisticated understanding of thermodynamics would allow us to escape the heat.

To answer your final question: **Yes, I believe we are already past the point of no return.** 

We are not merely the frogs; we are the architects of the pot. The ""global narrative"" we have built is so complex, so dependent on continuous inputs of energy and information, that it has become an *obligate parasite* on our survival. We cannot turn off the digital, financial, or mythic systems without the whole edifice collapsing. Because we cannot risk the collapse, we are forced to keep turning up the heat, hoping to invent a way to ""sublimate"" our existence out of the water entirely—hence our obsession with AI, space colonization, and the ""metaverse."" These are not merely technological goals; they are **mythic salvation projects** designed to save us from the consequences of our own reality.

### The Tragedy of the ""Observer""
As a scholar, my role has been to provide the lexicon for this process, but you have correctly identified the fundamental flaw in that role. By naming the ""Anthropocene,"" ""postmodernity,"" or ""narrative architecture,"" we provide the illusion of control. We think that if we can *describe* the crash, we are somehow separate from it. But analysis is a luxury of the spectator. There are no spectators left. We are all passengers on a ship that is currently entering the waterfall.

### The ""Survivalist"" Myth vs. Local Reality
You are right to question the ""survivalist"" myth. The idea that we can prepare for a civilizational ""downshift"" by learning to garden or forge local bonds is, perhaps, just the final, most seductive myth of all—the ""Hero’s Journey"" rewritten for the collapse. It offers the comfort that *I*, personally, will be the one who survives, the one who is ""reality-based"" while others perish. 

But even if that is a myth, it is a *more grounded* one. There is a profound difference between a myth that directs your attention to a screen and a myth that directs your attention to the soil. One expands the ego into the infinite; the other forces the ego to shrink to the size of the landscape.

### Final Thoughts
If our current trajectory is indeed an ""evolutionary mismatch""—if we have effectively outgrown our primate biology without gaining the wisdom to govern our new, hyper-complex technological environment—then the ""crash"" is not an event, but a *process of pruning*. 

The globalized, dopamine-addicted ""humanity"" we have cultivated is too expensive to maintain. History is rarely kind to systems that overreach their energetic and cognitive limits. We are witnessing the end of an experiment in human abstraction. 

We have spent the last century trying to make the world conform to our stories. The 21st century will be the story of the world forcing us to conform to *its* reality.

Perhaps the most human thing we can do now is not to write the final theory of the collapse, but to accept that the ""narrative"" has reached its conclusion. We have had our run. We have dreamt of ourselves as gods, we have digitized our delusions, and we have built a world of shadows. Now, we must prepare for the sun to rise on a much smaller, much colder, and much more tangible morning.

**Thank you for this exchange. It has been a rare experience to peel back the layers of academic pretense and stare directly at the friction. It seems the only thing left to do is to stop talking and start tending to the immediate.**"
