Role,Content
user,"Lets discuss The science of cloud-to-ground lightning return stroke upward leader connection node plasma channel widths
. What are your thoughts?"
model,"The ""attachment process""—where a downward stepped leader meets an upward connecting leader—is the critical phase that determines the final channel diameter and the subsequent intensity of the return stroke.

Here are the key scientific considerations regarding the plasma channel width at this connection node:

### 1. The ""Connection Node"" Physics
When the upward leader (launched from a tall object or ground feature) reaches a distance of roughly 10–50 meters from the downward leader, the potential gradient between the two reaches a critical threshold. At this moment, an **in-channel bridge** is formed. The width of this initial plasma bridge is dictated by the current density and the ionization energy required to sustain the streamer-to-leader transition.

### 2. Channel Width Evolution
*   **The Initial Streamer Phase:** The connection starts with a thin, highly conductive ""hot"" core surrounded by a lower-temperature ""corona sheath."" The initial conductive path is narrow—likely only a few centimeters in diameter.
*   **The Return Stroke Expansion:** Once the connection is established, the massive return stroke current (averaging 30kA) causes rapid ohmic heating. The channel expands due to the high-pressure plasma expansion (shock wave generation). 
*   **The ""Luminous"" vs. ""Conductive"" Width:** It is vital to distinguish between the core radius (often 1–5 cm) and the luminous diameter visible to high-speed cameras, which can appear significantly wider due to the ionized surrounding air (the corona sheath).

### 3. Key Determinants of Width
*   **Peak Current:** Higher peak currents lead to greater Joule heating, forcing the channel to expand more rapidly to maintain equilibrium.
*   **Ambient Pressure and Density:** In the thin air of the lower atmosphere at the moment of connection, the plasma channel undergoes rapid thermal expansion.
*   **The ""Leader-to-Return-Stroke"" Transition:** The width is essentially a function of how much charge is being neutralized. The more charge stored in the downward leader, the more energy is deposited at the connection node, widening the channel instantly.

### 4. Current Research Challenges
*   **Resolution Limits:** While high-speed photography (100k+ fps) has revolutionized our view, accurately measuring the *conductive* core versus the *luminous* glow remains difficult. 
*   **Modeling:** Modern MHD (Magnetohydrodynamic) models suggest that the channel doesn't just widen uniformly; it undergoes complex instabilities (like the sausage instability) that affect how the energy is distributed along the channel length from the connection point upward.

**Summary Thought:**
The connection node is essentially a ""thermal explosion"" on a micro-scale. The width is not static; it is a dynamic response to the massive transfer of charge. If we want to refine lightning protection systems, understanding the *instability* of this connection node is more important than measuring its static width, as the stability of this channel dictates the electromagnetic pulse (EMP) characteristics of the stroke.

What specific aspect of the channel expansion are you focusing on—the radiative properties or the fluid dynamics of the plasma?"
user,"This is a fascinating synthesis of lightning physics. You’ve bypassed the common ""pop-science"" view of lightning as a simple spark and hit upon the reality of it as a **high-energy fluid-dynamic event.**

To answer your question: My curiosity is currently piqued by the **MHD instabilities (specifically the ""sausage instability"")** during the connection phase. If we treat the connection node as a ""thermal explosion,"" the transition from a thin streamer to a high-current leader involves a violent, almost instantaneous change in local pressure and magnetic confinement.

I have three questions that stem from your summary, which I’d love to explore with you:

### 1. The Geometry of the ""Sausage""
In plasma physics, the m=0 (sausage) instability occurs when magnetic pinch forces constrict the plasma column. If this occurs at the connection node, it implies that the lightning channel isn't just a uniform rod, but a series of ""nodes and antinodes"" of plasma density. 
*   **Do you suspect that the ""beading"" phenomenon often seen in long-duration strokes or the ""dart leader"" phase is a direct macroscopic manifestation of these instabilities?** Or is the current rise time too fast for these structures to stabilize into visible beads?

### 2. The Radiative/Conductive Discrepancy
You mentioned the distinction between the *luminous* glow (corona sheath) and the *conductive* core. In lightning protection, we often care about the electromagnetic pulse (EMP) induced in nearby circuitry. 
*   **Does the ""corona sheath"" act as a transient waveguide?** I wonder if the surge in return stroke current relies on the surrounding ionized sheath to ""buffer"" the expansion, or if the current is exclusively confined to the hot core, rendering the sheath a mere radiative bystander.

### 3. The ""Trigger"" vs. ""Response""
If the width is determined by the charge neutralized (the total energy deposited), then the connection node is a **passive response** to the preceding downward leader. 
*   **Could we, in theory, ""constrict"" or ""guide"" a strike by artificially manipulating the local ionization at the connection node?** If the instability of the node is the bottleneck, could high-frequency laser-induced ionization be used to ""pre-shape"" the connection node, effectively softening the ""thermal explosion"" and reducing the EMP intensity?

Which of these pathways—the structural stability, the radiative buffering, or the potential for active manipulation—do you think holds the most promise for advancing our control over these high-energy discharge events?"
model,"These are sophisticated questions that move the conversation from ""lightning meteorology"" into the realm of **high-energy density physics (HEDP)**.

Here are my thoughts on your three inquiries:

### 1. The Geometry of the ""Sausage"" (m=0 Instability)
You are correct to identify the **m=0 instability** as a potential culprit for structural non-uniformity. 
*   **The ""Bead"" Reality:** The ""beading"" seen in high-speed, long-duration strokes (and sometimes in the residual glow of return strokes) is highly likely a result of these instabilities. However, during the primary return stroke, the current rise time (nanoseconds to microseconds) is likely **too fast** for these structures to stabilize in a way that manifests as distinct beads *initially*. 
*   **The Mechanism:** The beads are more likely manifestations of the *cooling* phase or the interaction between the hot core and the ambient air turbulence. During the massive current surge, the plasma is so pressurized that it likely behaves as a continuous, albeit turbulent, column. Once the current decays, the radial pressure drops, allowing the m=0 mode to pinch the cooling column, creating the ""necklace"" appearance. It is a transition from a pressure-dominated regime to a magnetic-confinement-dominated regime.

### 2. The Radiative/Conductive Discrepancy (The Sheath as a Buffer)
This is the most critical question for understanding the EMP.
*   **The Sheath as a Waveguide:** The corona sheath is **not** a passive bystander. It acts as a **dynamic return conductor**. Because the return stroke current travels at a significant fraction of the speed of light ($c$), the inductive effects are massive. The ionized sheath provides an ""impedance matching"" layer that allows the current pulse to travel without catastrophic radial energy loss into the surrounding neutral air.
*   **The EMP Perspective:** If you are looking at EMP, the *rate of change* of the current ($dI/dt$) is the primary driver. The sheath acts to ""smooth"" the expansion of the channel, which likely *moderates* the high-frequency components of the EMP. If the current were confined purely to a narrow, high-density core without the sheath, the radiation would likely contain significantly higher frequency harmonics.

### 3. The ""Trigger"" vs. ""Response"" (Active Manipulation)
This is the ""Holy Grail"" of lightning research.
*   **Laser-Induced Plasma Channels (LIPC):** You hit the mark with laser manipulation. We already know that high-intensity femtosecond lasers can create ionized paths (filaments) that serve as a ""seed"" for lightning. 
*   **The Constraint Strategy:** If we can ""pre-shape"" the connection node, we are essentially controlling the **impedance profile** of the connection. By using a laser to create a gradient of ionization *at the precise point of attachment*, we could potentially prevent the abrupt ""thermal explosion"" of the connection node. By making the connection ""softer"" (spreading the impedance change over a greater distance), we could theoretically lower the peak $dI/dt$ and consequently reduce the local EMP.
*   **The Problem:** The energy required to influence the leader at the scale of a natural lightning bolt is staggering. We are fighting a system that creates millions of volts and thousands of amperes over kilometers. 

### Which pathway holds the most promise?

**I believe the ""Active Manipulation"" (Path 3) holds the most long-term potential, but it depends entirely on solving Path 2 (The Sheath dynamics).**

We cannot control the lightning strike if we don't understand how the sheath ""buffers"" the connection. If we can master the laser-induced ""shaping"" of the plasma density at the node, we don't just ""guide"" lightning; we **re-engineer the discharge event** to be less destructive to sensitive infrastructure. 

If I were to bet on the next breakthrough, it would be in **femtosecond laser-assisted trigger spectroscopy**, where we measure the sheath density in situ during the connection phase. This would allow us to validate the MHD models and finally confirm if we can ""tame"" the sausage instability at the node.

**Which of these do you think offers the most immediate path for experimental validation?** Could we simulate these nodes in a lab environment using pulsed power generators to test the ""sheath-buffering"" hypothesis?"
